"Sneaker_name","Sneaker_url","Sneaker_img","Sneaker_title","Sneaker_title_url","Sneaker_brand","Sneaker_brand_url","Sneaker_price","Sneaker_description","Sneaker_brand_img","Sneaker_brand_img_url"
"On Cloud (blau / schwarz)","https://www.43einhalb.com/p/on-cloud-blau-schwarz-466369","https://43einhalb.com/media/252895/w/616/h/370/n/on-1999505-the-cloud-1.jpg","Cloud (blau / schwarz)","","On","","€ 139,95","Releasedate: 19.11.2020 | Online: 00:01 Uhr.
Für Füße, die sich den ganzen Tag bewegen wollen, gibt es neu den leichtesten On aller Zeiten: den Cloud mit extra Dämpfung und maximaler Flexibilität. Das patentierte CloudTec® Dämpfungssystem kombiniert eine weiche Landung mit einem harten Abstoss und vereint dadurch sowohl Komfort als auch Performance im gleichen Schuh. Für Läufer und alle anderen Athleten. Und das bei nur einem Gewicht von 198g (US M 8,5).
On erfindet somit müheloses Laufen. Die patentierte Sohle aus Zero-Gravity-Schaum vereint ultimative Leichtigkeit mit der überlegenen Dämpfung von 16 Cloud-Elementen für eine weiche Landung. Die raffinierte Schweizer Technologie bietet Verletzungsschutz und Dämpfungskomfort wo andere nur auf Gewichtsreduktion setzen. Mit anderen Worten: auf das pure Maximum reduziert.
Der Cloud fühlt sich gleich beim ersten Schritt unglaublich leicht und natürlich an. Ein paar Schritte mehr, und du vergisst, dass du überhaupt Schuhe trägst. Vergiss sogar, deine Schuhe zu schnüren: wähle die Option mit Elast-Schnürsenkel zum einfachen Reinschlüpfen oder wechsle zum mitgelieferten traditionellen Schnürsenkel.
Läuferprofil:
Läufer, die ein leichtes Laufgefühl mit maximaler Dämpfung wollen.
Ziel:
Laufe mit ultimativer Leichtigkeit und überragender Dämpfung.
Kategorie:
Leichtgewicht
Details:
Sprengung: 6 mm | 0.23 in
Gewicht: nur 165 g (US W 7) | 198 g (US M 8.5)","https://43einhalb.com/media/196879/w/240/h/158/n/196879.jpg","https://www.43einhalb.com/marken/on"
"Reebok Classic Leather (weiß)","https://www.43einhalb.com/p/reebok-classic-leather-weiss-429442","https://43einhalb.com/media/253105/w/616/h/370/n/reebok-fv2107-cl-lthr-1.jpg","Cloud Hi (grau)","https://www.43einhalb.com/p/on-cloud-hi-grau-362677","On","https://www.43einhalb.com/p/on-cloud-hi-grau-362677","€ 89,95","Ein Sneaker, der einfach nie aus der Mode kommt – Der Reebok Classic Leather macht seinen Namen alle Ehren und überzeugt als zeitloser Klassiker.
Mit seinem schlichten Design und der schönen Low-Cut Silhouette hat sich der Reebok Classic Leather zum absoluten All-Day-Carry Sneaker gemausert. Und das uu Recht! Mit dem Reebok Classic Leather ist nämlich eine wahre Running Legende in unser Sortiment gewandert, deren Retro-Charm niemandem entgeht. Das schlichte Modell mit der leichten, gestanzten EVA-Zwischensohle prägte die Reebok-Laufgeschichte wie kaum ein anderer Schuh - und zeigt auch heute noch, wie gut ein alter Laufhase aussehen kann.
Hier kommt der Reebok Classic Leather mit einem schönen »All White« Colorway daher!","https://43einhalb.com/media/244388/w/240/h/158/n/244388.jpg","https://www.43einhalb.com/marken/reebok"
"Vans Old Skool (rot / weiß)","https://www.43einhalb.com/p/vans-old-skool-rot-weiss-425912","https://43einhalb.com/media/249909/w/616/h/370/n/vans-vn0a4u3b18n1-old-skool-1.jpg","ML574SSO (rot)","https://www.43einhalb.com/p/new-balance-ml574sso-rot-406879","New Balance","https://www.43einhalb.com/p/new-balance-ml574sso-rot-406879","€ 89,95","","https://43einhalb.com/media/103047/w/240/h/158/n/103047.jpg","https://www.43einhalb.com/marken/vans"
"Reebok Classic Leather (weiß / navy)","https://www.43einhalb.com/p/reebok-classic-leather-weiss-navy-430008","https://43einhalb.com/media/242296/w/616/h/370/n/reebok-fv9303-cl-lthr-1.jpg","Force 1 TD (weiß)","https://www.43einhalb.com/p/nike-force-1-td-weiss-251838","Nike","https://www.43einhalb.com/p/nike-force-1-td-weiss-251838","€ 89,95","Ein Sneaker, der einfach nie aus der Mode kommt – Der Reebok Classic Leather macht seinen Namen alle Ehren und überzeugt als zeitloser Klassiker.
Mit seinem schlichten Design und der schönen Low-Cut Silhouette hat sich der Reebok Classic Leather zum absoluten All-Day-Carry Sneaker gemausert. Zu Recht!
Mit dem Reebok Classic Leather ist nämlich eine wahre Running Legende in unser Sortiment gewandert, deren Retro-Charm niemandem entgeht. Das schlichte Modell mit der leichten, gestanzten EVA-Zwischensohle prägte die Reebok-Laufgeschichte wie kaum ein anderer Schuh - und zeigt auch heute noch, wie gut ein alter Laufhase aussehen kann.
Hier kommt der Reebok Classic Leather mit einem weißen Leder-Upper und blauen Details daher.","https://43einhalb.com/media/244388/w/240/h/158/n/244388.jpg","https://www.43einhalb.com/marken/reebok"
"HOKA ONE ONE M Stinson ATR 6 (grau / orange)","https://www.43einhalb.com/p/hoka-one-one-m-stinson-atr-6-grau-orange-479652","https://43einhalb.com/media/255552/w/616/h/370/n/hoka-one-one-1110506-fgbm-m-stinson-art-6-1.jpg","M Stinson ATR 6 (grau / orange)","","HOKA ONE ONE","","€ 159,95","","https://43einhalb.com/media/218277/w/240/h/158/n/218277.jpg","https://www.43einhalb.com/marken/hoka-one-one"
"Reebok Club C 85 (weiß / grün)","https://www.43einhalb.com/p/reebok-club-c-85-weiss-gruen-432436","https://43einhalb.com/media/245129/w/616/h/370/n/reebok-fx3874-club-c-85-1.jpg","Force 1 TD (weiß)","https://www.43einhalb.com/p/nike-force-1-td-weiss-251838","Nike","https://www.43einhalb.com/p/nike-force-1-td-weiss-251838","€ 119,95","Der Reebok Club C 85 feiert 35-jähriges Jubiläum!
Für Reebok stehen Tradition und Authentizität an erster Stelle: Statt auf ausgefallene, futuristische Modelle zu setzen, bleiben die Macher von Reebok lieber ihren Wurzeln treu und präsentieren mit dem Club C 85 den nächsten Klassiker aus den 80er Jahren.
Zur Freude der Retro-Fans hat sich der Sneaker optisch im Vergleich zum Vorbild von 1985 kaum verändert, an neuen technischen Features wurde allerdings nicht gespart. So stattet Reebok den Klassiker mit einer Eva-Midsole für die optimale Dämpfung und einem abriebfesten Rubber für zuverlässigen Grip aus.
Zu seinem 35-jährigem Jubiläum kommt der Reebok Club C 85 mit gewohntem cleanen Upper daher. Die starken grünen Details und der coole »Club C 85 Anniversary«-Anhänger runden den starken Look perfekt ab.","https://43einhalb.com/media/244388/w/240/h/158/n/244388.jpg","https://www.43einhalb.com/marken/reebok"
"New Balance ML574NLC (schwarz / grau)","https://www.43einhalb.com/p/new-balance-ml574nlc-schwarz-grau-408167","https://43einhalb.com/media/238500/w/616/h/370/n/nb-819421-60-8-ml574nlc-1-kopie.jpg","Cloud Hi (grau)","https://www.43einhalb.com/p/on-cloud-hi-grau-362677","On","https://www.43einhalb.com/p/on-cloud-hi-grau-362677","€ 99,95","Wenn man von New Balance spricht, kommt zwangsläufig der 574er zur Sprache. Es ist das seit 1988 immer leuchtende Aushängeschild der Laufschuhmarke, welches Liebhaber als auch New Balance Neulinge gleichermaßen begeistert!
Ausgestattet mit dem ENCAP-System, welches zusätzlich Stabilität und Dämpfung bringt, war der New Balance 574 viele Jahre einer der beliebtesten Laufschuhe. Heute ist er der solideste Lifestyle-Sneaker im New Balance Sortiment, nicht zuletzt weil er den Spagat zwischen Sportlichkeit und Casual wie kaum ein anderer Sneaker beherrscht.
Hier kommt der New Balance ML574NLC mit einem schönen, schlichten Upper bestehend aus mehreren grauen Mesh-Panels, schwarzen Suede Overlays und einer ebenfalls grauen Outsole daher.","https://43einhalb.com/media/212737/w/240/h/158/n/212737.jpg","https://www.43einhalb.com/marken/new-balance"
"Puma Basket VTG (weiß / rot)","https://www.43einhalb.com/p/puma-basket-vtg-weiss-rot-472921","https://43einhalb.com/media/251321/w/616/h/370/n/puma-374922-02-basket-vtg-1.jpg","Force 1 TD (weiß)","https://www.43einhalb.com/p/nike-force-1-td-weiss-251838","Nike","https://www.43einhalb.com/p/nike-force-1-td-weiss-251838","€ 89,95","Releasedate: 01.11:2020 | Online: 00:01 Uhr.
Zum Ende des Jahres haben wir noch ein echtes Highlight für Euch im Repertoire - die Rückkehr des Puma Baskets VTG als ein-zu-eins Remake der Originalversion! Als Basketball-Version des legendären Puma Suede schrieb das Kult-Modell Geschichte in Zeiten, als die NBA mit ihren strengen Regeln bezüglich der Sportschuhe längst nicht so war, wie wir sie heute kennen. Nach seinem Debüt auf dem Basketball-Parkett dauerte es auch nicht mehr lange, bis der Basket auf der Straße adaptiert wurde und zunehmend von B-Boys und Sprayern getragen wurde.
Im Jahr 2021 feiert der Kult-Schuh bereits sein 50. Jubiläum, und um den Geburtstag gebührend einzuleiten geht es jetzt schon mit den ersten Releases los. Wie schon damals überzeugt der Puma Basket VTG durch seine Robustheit und sein cleanes Erscheinungsbild. Der Sneaker kommt mit einem Upper aus Glattleder daher, farblich abgesetzten Puma Streifen aus Velour-Leder und einem Lining, das ebenfalls aus Leder besteht - Eigenschaften, die den Basket zum perfekten Alltags-Begleiter machen. Natürlich darf getreu der OG-Version das legendäre Puma Gold-Foil Branding nicht fehlen!","https://43einhalb.com/media/59719/w/240/h/158/n/59719.jpg","https://www.43einhalb.com/marken/puma"
"Vans SK8-Hi 46 MTE DX (multi)","https://www.43einhalb.com/p/vans-sk8-hi-46-mte-dx-multi-465077","https://43einhalb.com/media/253697/w/616/h/370/n/vans-vn0a3dq52uf1-ua-sk8-hi-mte-dx-1.jpg","WL574ANA (schwarz / grau / leo)","https://www.43einhalb.com/p/new-balance-wl574ana-schwarz-grau-leo-408847","New Balance","https://www.43einhalb.com/p/new-balance-wl574ana-schwarz-grau-leo-408847","€ 109,95","Dieses Gründungsmitglied von Vans’ legendärem High Top-Skateschuh-Erbe war der erste Schuh, der den unterstützenden Halt eines Sportschuhs ind die Welt des Skates brachte. Die Beliebtheit des SK8-Hi-Looks folgte auf dem Fuße, und der Schuh wurde schnell ein Favorit bei Skatern, Musikern, Künstlern und in vielen Subkulturen. Bis zum heutigen Tag hat er seine Original-Form beibehalten. Der zeitlose Klassiker wird seit jeher aus robustem Obermaterial und mit Waffelprofil-Laufsohle gefertigt.","https://43einhalb.com/media/103047/w/240/h/158/n/103047.jpg","https://www.43einhalb.com/marken/vans"
"New Balance WL574VAD (grün / weiß / gelb)","https://www.43einhalb.com/p/new-balance-wl574vad-gruen-weiss-gelb-408761","https://43einhalb.com/media/240238/w/616/h/370/n/nb-819601-50-6-wl574vad-1.jpg","Classic Slip-On (schwarz / weiß / rot)","https://www.43einhalb.com/p/vans-classic-slip-on-schwarz-weiss-rot-426732","Vans","https://www.43einhalb.com/p/vans-classic-slip-on-schwarz-weiss-rot-426732","€ 99,95","Wenn man von New Balance spricht, kommt zwangsläufig der 574er zur Sprache. Es ist das seit 1988 immer leuchtende Aushängeschild der Laufschuhmarke, welches Liebhaber als auch New Balance Neulinge gleichermaßen begeistert!
Ausgestattet mit dem ENCAP-System, welches zusätzlich Stabilität und Dämpfung bringt, war der New Balance 574 viele Jahre einer der beliebtesten Laufschuhe. Heute ist er der solideste Lifestyle-Sneaker im New Balance Sortiment, nicht zuletzt weil er den Spagat zwischen Sportlichkeit und Casual wie kaum ein anderer Sneaker beherrscht.
Hier kommt der New Balance WL574VAD in einem farbenfrohen Colorway daher, der vor allem durch die türkisen und pinken Farbakzente für einen echten Eye-Catcher sorgt.","https://43einhalb.com/media/212737/w/240/h/158/n/212737.jpg","https://www.43einhalb.com/marken/new-balance"
"New Balance GW500SB1 (weiß)","https://www.43einhalb.com/p/new-balance-gw500sb1-weiss-406289","https://43einhalb.com/media/248308/w/616/h/370/n/nb-gw500sb1-1.jpg","Force 1 TD (weiß)","https://www.43einhalb.com/p/nike-force-1-td-weiss-251838","Nike","https://www.43einhalb.com/p/nike-force-1-td-weiss-251838","€ 74,95","Ein absoluter Klassiker: Der New Balance GW500SB1 überzeugt im klassischen Stil mit stromlinienförmigen Design, das ganz klar von dem beliebten 574 inspiriert worden ist.
Während die EVA-Mittelsohle und das Mesh-Upper für athletischen Komfort und Leichtigkeit sorgen, liefert die Farbkombi aus Weiß und Rosa sowie die zusätzlichen hellblauen Details einen modernen Look.","https://43einhalb.com/media/212737/w/240/h/158/n/212737.jpg","https://www.43einhalb.com/marken/new-balance"
"New Balance WL996WE (beige / rot)","https://www.43einhalb.com/p/new-balance-wl996we-beige-rot-406941","https://43einhalb.com/media/246540/w/616/h/370/n/nb-819771-50-3-wl996we-1.jpg","V-10 - B-MESH (beige / weiß)","https://www.43einhalb.com/p/veja-v-10%09-b-mesh-beige-weiss-392484","VEJA","https://www.43einhalb.com/p/veja-v-10%09-b-mesh-beige-weiss-392484","€ 94,95","Der 996 gehört seit seiner Erstveröffentlichung 1987 zu den Ikonen im New Balance Sortiment. Er war der allererste Running-Schuh, der die 100$-Preis-Marke knackte. Und das nicht ohne Grund. Seine Revlite-Sohleneinheit, seine Gummi-Außensohle und der Suede-Upper begeisterten Läufer und Athleten rund um den Globus.
Jetzt ist er in seiner Original-Silhouette zurück und wir sind hin und weg. Beiges Suede und Mesh mit einheitlichem Stitching, die Zunge aus Textil mit gewobenem Label, ein dunkel-rosanes abgesetztes »N-Branding« auf der Seite und ein dazu passender, frischer Farbakzent auf der Midsole, der diesen schönen, girly Colorway gelungen abschließt. Das ist der Stoff aus dem Retro-Träume gemacht sind!","https://43einhalb.com/media/212737/w/240/h/158/n/212737.jpg","https://www.43einhalb.com/marken/new-balance"
"Vans Vault Old Skool LX (lila)","https://www.43einhalb.com/p/vans-vault-old-skool-lx-lila-465385","https://43einhalb.com/media/252491/w/616/h/370/n/vans-vn0a4bvf2tp1-ua-old-skool-vlt-lx-1.jpg","Old Skool (lila / weiß)","https://www.43einhalb.com/p/vans-old-skool-lila-weiss-426032","Vans","https://www.43einhalb.com/p/vans-old-skool-lila-weiss-426032","€ 99,95","Der Vans Old Skool gehört mit Sicherheit zu den legendärsten Schuhen überhaupt, und das nicht nur im Skate-Bereich! Obendrein ist der Old Skool der erste Schuh der Marke, der das bekannte Side-Stripe Branding der kalifornischen Skate-Brand tragen durfte. Durch sein cleanes und stylishes Design dauerte es nicht lange, bis der robuste Old Skool auch außerhalb der Skate-Szene Fuß fasste!
In diesem Pack bekommt der Old Skool ein luxuriöses, von Tieren inspiriertes Make-Over, denn das Upper des Schuhs besteht aus Suede und Leder-Panels mit Alligator-Prägung. Hier releast Vans Vault den Old Skool LX in einem all-over lilanen Colorway.","https://43einhalb.com/media/103047/w/240/h/158/n/103047.jpg","https://www.43einhalb.com/marken/vans"
"Vans Style 36 (schwarz / weiß / rot)","https://www.43einhalb.com/p/vans-style-36-schwarz-weiss-rot-426548","https://43einhalb.com/media/243745/w/616/h/370/n/vans-vn0a3dz31iw1-styel-36-1.jpg","Cloud ""All Black""","https://www.43einhalb.com/p/on-cloud-all-black-106398","On","https://www.43einhalb.com/p/on-cloud-all-black-106398","€ 79,95","Der Vans Style 36 ist ein Low-Top-Silhouette, die dank des legendären Seitenstreifens absoluten Kultstatus unter den Vans-Klassikern erreichen konnte. Die verstärkte Zehenkappe sowie der gepolsterte Schaftrand schützen vor Abnutzung und sorgen für zusätzlichen Komfort.
Hier kommt der Vans Style 36 in einem vorwiegend schwarzen Colorway daher, bei dem die Seitenfläche mit dem für Vans typischen Schachbrett-Muster hinterlegt ist. Zusätzlich befinden sich rote Print-Details auf dem Upper des Schuhs.
CANVAS+WATERBASED SCREENPRINT DIRECTIONAL-SUEDE-VIRGIN - Upper Material Leather 47,84%; Upper Material Textile 52,16%; Upper Material Rubber Plastic 0%; - Textile","https://43einhalb.com/media/103047/w/240/h/158/n/103047.jpg","https://www.43einhalb.com/marken/vans"
"VEJA V-10 B-Mesh (weiß / gold)","https://www.43einhalb.com/p/veja-v-10-b-mesh-weiss-gold-515396","https://43einhalb.com/media/255618/w/616/h/370/n/veja-women-vx012463a-b-mesh-1.jpg","V-10 B-Mesh (weiß / gold)","","VEJA","","€ 114,95","Nachhaltig. Fair. Zeitlos. - »Sneakers that are made differently«!
Seit der Unternehmensgründung 2005 stellt VEJA erfolgreich unter Beweis, dass Stilbewusstsein und Nachhaltigkeit auch in der Sneaker-Branche Hand in Hand gehen können. Dabei ist die Idee hinter einem Paar VEJA Sneaker genau so simpel wie genial: Schlüpfe mit einem Fuß in überzeugendes Design und übernehme mit dem anderen soziale Verantwortung!
Doch erstmal von vorne: Im Jahr 2005 stellten sich die beiden französischen VEJA-Gründer Sébastien Kopp und François-Ghislain Morillion eine folgenreiche Frage: »Ist eine andere Welt möglich?« . Um eine Antwort auf diese entscheidende Frage zu finden, begaben sich die Zwei auf eine lange Reise, auf der sie die Entwicklung und Produktion von Turnschuhen sowie die entstehenden Rohstoffpreise nachvollziehen und verstehen wollten. Während ihrer Reise fanden sie nicht nur eine bejahende Antwort auf ihre Frage, sondern auch den Namen ihres neuen Unternehmens - VEJA ist Portugiesisch und beutetet »Schau hin!«. Und genau dies tut das innovative und umweltbewusste Label auch: Getrieben von der Vision das Konsumverhalten nachhaltig zu verändern, setzt VEJA auf transparente Produktionsketten, faire Arbeitsbedingungen und umweltfreundliche Materialien.
Wie alle VEJA-Modelle wurde auch der »VEJA V 10 B-Mesh« in Brasilien unter fairsten Arbeitsbedingungen und aus nachhaltigen Materialen hergestellt. Das besondere an dieser Aufmachung auf jeden Fall das verwendete B-Mesh, ein Material aus recyceltem Plastikflaschen (drei Plastikflaschen ergeben ein Paar Sneaker). Auch das Innenfutter besteht aus recyceltem Polyester, während die Sohle aus nachhaltigem Naturkautschuk gefertigt ist. Selbstverständlich braucht der »V 10 B-Mesh« sich auch in Sachen Optik nicht zu verstecken. Das weiße Mesh-Upper mit beigen Suede Overlays garantiert das VEJA-typische cleane Design und einen zeitlosen Look.","https://43einhalb.com/media/237386/w/240/h/158/n/237386.jpg","https://www.43einhalb.com/marken/veja"
"HOKA ONE ONE M Speedgoat 4 (rot / dunkelblau)","https://www.43einhalb.com/p/hoka-one-one-m-speedgoat-4-rot-dunkelblau-479736","https://43einhalb.com/media/255549/w/616/h/370/n/hoka-one-one-1106525-fpbl-m-speedgoat-4-1.jpg","M Speedgoat 4 (rot / dunkelblau)","","HOKA ONE ONE","","€ 139,95","","https://43einhalb.com/media/218277/w/240/h/158/n/218277.jpg","https://www.43einhalb.com/marken/hoka-one-one"
"HOKA ONE ONE M Challenger ATR 6 GTX (schwarz / gold)","https://www.43einhalb.com/p/hoka-one-one-m-challenger-atr-6-gtx-schwarz-gold-479610","https://43einhalb.com/media/255557/w/616/h/370/n/hoka-one-one-1116876-bgsh-m-challenger-6-gtx-1-kopie.jpg","M Challenger ATR 6 GTX (schwarz / gold)","","HOKA ONE ONE","","€ 139,95","","https://43einhalb.com/media/218277/w/240/h/158/n/218277.jpg","https://www.43einhalb.com/marken/hoka-one-one"
"Reebok AD Court (weiß / beige / rot)","https://www.43einhalb.com/p/reebok-ad-court-weiss-beige-rot-457474","https://43einhalb.com/media/255276/w/616/h/370/n/reebok-women-fy7358-ad-court-1.jpg","Force 1 TD (weiß)","https://www.43einhalb.com/p/nike-force-1-td-weiss-251838","Nike","https://www.43einhalb.com/p/nike-force-1-td-weiss-251838","€ 89,95","","https://43einhalb.com/media/244388/w/240/h/158/n/244388.jpg","https://www.43einhalb.com/marken/reebok"
"Nike Air Max III ""Laser Blue""","https://www.43einhalb.com/p/nike-air-max-iii-laser-blue-414106","https://43einhalb.com/media/242555/w/616/h/370/n/nike-cj6779-100-air-max-iii-1.jpg","Force 1 TD (weiß)","https://www.43einhalb.com/p/nike-force-1-td-weiss-251838","Nike","https://www.43einhalb.com/p/nike-force-1-td-weiss-251838","€ 149,95","Releasedate: 01.08.2020 | Online: 09:00 Uhr.
The Nike Air Max III is back!
Anlässlich des 30. Jubiläums der ikonischen Air Max 90 Silhouette lässt es Nike nochmal so richtig krachen und geht mit dem neuen »Laser Blue« an den Start!
1987 präsentierte Tinker Hatfield erstmals seinen ganzen Stolz - die sichtbare Air Unit im Air Max 1. Nur wenige Jahre später folgte der Air Max 90, dessen Air-Unit nicht nur um einiges größere war als die des 1er AM, sondern zusätzlich durch farbliche Akzente hervorgehoben wurde. Der AM90 ist eine absolute Legende unter Nike's Air-Reihe und das bereits seit 30 Jahren! Für Nike, und für uns, ein Grund dieses Jubiläum ordentlich zu feiern!
Technisch gesehen, entsprach der Air Max 90 schon damals einer ganz anderen Liga. Kreiert als Performance Laufschuh, wurde der AM90 mit einer neuen Mittelsohle aus zwei getrennten Teilen geschaffen. Das machte den Sneaker noch bequemer und garantierte zudem eine höhere Haltbarkeit. Außerdem versah Hatfield den 90er mit seinem Markenzeichen: Dem angeschnittenen Nike »Swoosh«.
Dieses Jahr präsentierte Nike schon so einige geniale, brandneue Colorways vom AM90, wie dem »90‘s Dancefloor« oder dem »Cuban Link«. Doch mit dem »Laser Blue« beruft sich der Swoosh auf die Anfänge der ikonischen Silhouette und setzt auf OG Vibes. Dabei lässt sich Nike nicht nur im Colorway, sondern auch in der Namensgebung von den Ursprüngen inspirieren. Der Air Max 90 war vor 2006 nämlich ausschließlich unter dem Namen Air Max III bekannt. Das 30. Jubiläum der AM-Ikone ist nun der perfekte Anlass, um nicht nur eine OG-Colorway, sondern auch den OG-Namen zurückzuholen.
Der Nike Air Max III »Laser Blue« kommt im starken OG-Colorway mit weißem Upper und starken Akzenten in Schwarz, Grau und Laser Blue.","https://43einhalb.com/media/58940/w/240/h/158/n/58940.jpg","https://www.43einhalb.com/marken/nike"
"Puma Mirage OG (grau / blau / pink)","https://www.43einhalb.com/p/puma-mirage-og-grau-blau-pink-472688","https://43einhalb.com/media/253979/w/616/h/370/n/puma-372976-06-mirage-og-1.jpg","Cloud Hi (grau)","https://www.43einhalb.com/p/on-cloud-hi-grau-362677","On","https://www.43einhalb.com/p/on-cloud-hi-grau-362677","€ 89,95","Puma feiert das Comeback des Mirage OG und bringt den legendären Laufschuh in einer straßentauglichen Neuauflage zurück in unsere Regale!
Der Mirage ist seit fast einem halben Jahrhundert fester Bestandteil der Puma Familie. Während der Mirage in den 70ern als Leichtathletikschuh seinen Release feierte, machte die sportliche Silhouette in den 90ern vor allem als leichter Laufschuh von sich Reden. Im Jahr 2020 feiert der Mirage OG nun sein Comeback als coole Lifestyle-Silhouette und liefert die perfekte Ergänzung zu jedem Style.
Der Mirage OG überzeugt weiterhin mit den typischen Features eines funktionalen Runners. So sorgen das leichte Textil-Upper für angenehme Leichtigkeit und die gestanzte EVA-Zwischensohle für optimale Dämpfung. Lässige Suede-Overlays, Formstreifen aus Kunstleder, sowie ein verspieltes Fersendetail liefern on top einen straßentauglichen Look. Hier kommt der Puma Mirage OG in einer starken Farbkombi aus Blau, Pink und Grau.","https://43einhalb.com/media/59719/w/240/h/158/n/59719.jpg","https://www.43einhalb.com/marken/puma"
"Vans Old Skool (khaki / weiß)","https://www.43einhalb.com/p/vans-old-skool-khaki-weiss-465487","https://43einhalb.com/media/251447/w/616/h/370/n/vans-vn0a4u3b2t41-ua-old-skool-1.jpg","Atacama (olive / schwarz)","https://www.43einhalb.com/p/birkenstock-atacama-olive-schwarz-400724","Birkenstock","https://www.43einhalb.com/p/birkenstock-atacama-olive-schwarz-400724","€ 89,95","Am 16. März 1966 eröffnete Paul Van Doren mit seinen Partnern Jim Van Doren, Gordy Lee und Serge D’Elia in Anaheim (Kalifornien, USA) den ersten Vans Shop.
Am 19. März 1976 kam das Unternehmen den vielen Nachfragen von Skateboardern nach und brachte den ersten Schuh mit zwei Farben (rot und blau) auf den Markt. Das Design stammte von den zu diesem Zeitpunkt aufsteigenden Skateboardern Stacy Peralta und Tony Alva, welche dem revolutionären Zephyr Skate Team angehörten.
Zu den bekanntesten Modelle gehört zweifelsohne auch der Old Skool. Dieser Schuh ist das erste Modell der amerikanischen Marke, auf welchem der klassische Vans-Seitenstreifen zu sehen war. Der Sneaker überzeugt durch seinen schlichten, zeitlosen Stil, als auch durch Funktionalität. Er passt sowohl zum locker-schicken Outfit, hat sich aber ebenfalls bei der Skate-Community wegen seiner hohen Strapazierfähigkeit bewährt. Der niedrige Schnürschuh kommt mit einem Obermaterial aus robustem Suede, verstärkter Zehenkappe für starke Beanspruchung, charakteristischer Waffel-Gummilaufsohle und gepolstertem Schaft für mehr Halt und Flexibilität, daher.
Hier kommt der Vans Old Skool in einem schlichten, dunkelgrünen Colorway daher, der Euch garantiert mit dem nötigen Cleaness-Faktor versorgt.","https://43einhalb.com/media/103047/w/240/h/158/n/103047.jpg","https://www.43einhalb.com/marken/vans"
