"Sneaker_name","Sneaker_url","Sneaker_img","Sneaker_title","Sneaker_title_url","Sneaker_brand","Sneaker_brand_url","Sneaker_price","Sneaker_description","Sneaker_brand_img","Sneaker_brand_img_url"
"Nike WMNS Air Force 1 LXX ""Snakeskin"" (weiß / rot / blau)","https://www.43einhalb.com/p/nike-wmns-air-force-1-lxx-snakeskin-weiss-rot-blau-452506","https://43einhalb.com/media/250587/w/616/h/370/n/nike-women-dc1164-100-air-force-1-lxx-1.jpg","Force 1 TD (weiß)","https://www.43einhalb.com/p/nike-force-1-td-weiss-251838","Nike","https://www.43einhalb.com/p/nike-force-1-td-weiss-251838","€ 109,95","Releasedate: 17.10.2020 | Online: 09:00 Uhr | Instore: Fulda.
Im Jahre 1982 wurde der Air Force 1 erstmals auf den Markt gebracht. Es ist der Nike-Sneaker, der wohl den höchsten Wiedererkennungswert überhaupt genießt, nicht zuletzt weil er in der HipHop-Szene über Jahrzehnte gefeiert wurde wie kein anderer Sneaker. Auch aus technischer Sicht muss sich dieser Klassiker nicht verstecken: Der Air Force 1 kommt mit einem durchgehenden Air-Element für leichte Dämpfung und angenehmes Tragegefühl. Zudem sorgt die Gummi-Außensohle für den nötigen Grip.
Beim neuen Air Force 1 LXX setzt Nike auf den angesagten Deconstructed Look. Das Upper kommt aus hochwertigem Leder daher, während sich die Swooshs in farblich abgesetzten Suede mit einer Snakeskin Prägung hervorheben. Zudem werden an der Ferse und den Swooshes durch abwechselndes Colorblocking Akzente gesetzt: der linke Schuh verwendet Rot auf dem äußeren Swoosh, Blau auf dem medialen Swoosh und das Heeltab ist ebenfalls blau gehalten. Der rechte Schuh kommt als exaktes Spiegelbild zum linken, wodurch ein außergewöhnlicher Yin & Yang Look entsteht. Abgerundet wird das Design durch eine nach außen gedrehten Zunge, an der zudem das Größen-Tag zu sehen ist.","https://43einhalb.com/media/58940/w/240/h/158/n/58940.jpg","https://www.43einhalb.com/marken/nike"
"On Cloudnova (Black / Eclipse)","https://www.43einhalb.com/p/on-cloudnova-black-eclipse-362813","https://43einhalb.com/media/234742/w/616/h/370/n/on-2699822-cloudnova-1.jpg","Cloud ""All Black""","https://www.43einhalb.com/p/on-cloud-all-black-106398","On","https://www.43einhalb.com/p/on-cloud-all-black-106398","€ 159,95","Releasedate: 07.05.2020 | Online: 00:01 Uhr.
Die Schweizer Running-Brand On überrascht uns jetzt mit einem ultralimitierten Sneaker, der Dir Performance-Technologie für jeden Tag bietet!
Der Cloudnova ist das neueste Mitglied der On-Familie und wurde speziell für den Lifestyle-Bereich kreiert, allerdings findest Du auch hier die charakteristische Lauftechnologie von On. Das neue Modell vereint das ganze Wissen des Sportartikelherstellers über Performance-Running mit einer neuartigen Sneaker-Silhouette. Komfort, Performance und Design für urbane Entdeckungsreisen – all das findest Du vereint im Cloudnova.
Verbundene CloudTec®-Elemente der nächsten Generation dämpfen den Aufprall des On Cloudnova und ein spezielles Speedboard™ sorgt für Power. Gummi-Elemente fördern die natürliche Abrollbewegung und dank des neuen Zungen-Designs passt sich der Schuh jedem Fuss optimal an.
Die einzigartige »Fersenzunge« und die innere Sockenkonstruktion sorgen für einen angenehm weichen Tragkomfort. Die gepolsterte Fersenpartie und die individuell verstellbare Schnürung sorgen für die perfekte Passform und maximale Bewegungsfreiheit. Entdecke deine Stadt und erlebe, was in ihr steckt – und in dir selbst.","https://43einhalb.com/media/196879/w/240/h/158/n/196879.jpg","https://www.43einhalb.com/marken/on"
"On Cloudnova (grau / grün)","https://www.43einhalb.com/p/on-cloudnova-grau-gruen-460627","https://43einhalb.com/media/247796/w/616/h/370/n/on-2699818-cloudnova-1-kopie.jpg","Cloud Hi (grau)","https://www.43einhalb.com/p/on-cloud-hi-grau-362677","On","https://www.43einhalb.com/p/on-cloud-hi-grau-362677","€ 159,95","Releasedate: 17.09.2020 | Online: 00:01 Uhr.
Die Schweizer Running-Brand On überrascht uns jetzt mit einem ultralimitierten Sneaker, der Dir Performance-Technologie für jeden Tag bietet!
Der Cloudnova ist das neueste Mitglied der On-Familie und wurde speziell für den Lifestyle-Bereich kreiert, allerdings findest Du auch hier die charakteristische Lauftechnologie von On. Das neue Modell vereint das ganze Wissen des Sportartikelherstellers über Performance-Running mit einer neuartigen Sneaker-Silhouette. Komfort, Performance und Design für urbane Entdeckungsreisen – all das findest Du vereint im Cloudnova.
Verbundene CloudTec®-Elemente der nächsten Generation dämpfen den Aufprall des On Cloudnova und ein spezielles Speedboard™ sorgt für Power. Gummi-Elemente fördern die natürliche Abrollbewegung und dank des neuen Zungen-Designs passt sich der Schuh jedem Fuss optimal an.
Die einzigartige »Fersenzunge« und die innere Sockenkonstruktion sorgen für einen angenehm weichen Tragkomfort. Die gepolsterte Fersenpartie und die individuell verstellbare Schnürung sorgen für die perfekte Passform und maximale Bewegungsfreiheit. Entdecke deine Stadt und erlebe, was in ihr steckt – und in dir selbst.","https://43einhalb.com/media/196879/w/240/h/158/n/196879.jpg","https://www.43einhalb.com/marken/on"
"KangaROOS Aussie OG Prep 2.0 (grün)","https://www.43einhalb.com/p/kangaroos-aussie-og-prep-20-gruen-462892","https://43einhalb.com/media/247771/w/616/h/370/n/kangaroos-47268-000-8000-aussie-1-kopie.jpg","Atacama (olive / schwarz)","https://www.43einhalb.com/p/birkenstock-atacama-olive-schwarz-400724","Birkenstock","https://www.43einhalb.com/p/birkenstock-atacama-olive-schwarz-400724","€ 99,95","Mit dem Aussie Prep 2.0 bringt Kangaroos einen soliden Runner in klassischer Retro-Optik an den Start. Das Upper des Schuhs wurde hier fast monoton gehalten, denn es verfügt nur über wenige, dafür gezielt eingesetzte farbliche Akzente, die den Schuh zusätzlich hervorheben. Auch der Material-Mix dieses neuen Sneakers weiß zu überzeugen, denn neben Suede wurden verschiedene Mesh-Gewebe genutzt, die sich unter anderem auf der Toebox und unter dem auffälligen Kangaroos-Branding befinden. Natürlich kommt auch der Kangaroos Aussie Prep 2.0 mit der bekannten Tasche in der Zunge daher.","https://43einhalb.com/media/850/w/240/h/158/n/850.jpg","https://www.43einhalb.com/marken/kangaroos"
"VEJA V-10 Leather (weiß / rot / rose)","https://www.43einhalb.com/p/veja-v-10-leather-weiss-rot-rose-439044","https://43einhalb.com/media/245851/w/616/h/370/n/veja-vx022292a-v-10-leather-1.jpg","V-10 Leather (weiß / rot / rose)","","VEJA","","€ 124,95","Nachhaltig. Fair. Zeitlos. - »Sneakers that are made differently«!
Seit der Unternehmensgründung 2005 stellt VEJA erfolgreich unter Beweis, dass Stilbewusstsein und Nachhaltigkeit auch in der Sneaker-Branche Hand in Hand gehen können. Dabei ist die Idee hinter einem Paar VEJA Sneaker genau so simpel wie genial: Schlüpfe mit einem Fuß in überzeugendes Design und übernehme mit dem anderen soziale Verantwortung!
Doch erstmal von vorne: Im Jahr 2005 stellten sich die beiden französischen VEJA-Gründer Sébastien Kopp und François-Ghislain Morillion eine folgenreiche Frage: »Ist eine andere Welt möglich?« . Um eine Antwort auf diese entscheidende Frage zu finden, begaben sich die Zwei auf eine lange Reise, auf der sie die Entwicklung und Produktion von Turnschuhen sowie die entstehenden Rohstoffpreise nachvollziehen und verstehen wollten. Während ihrer Reise fanden sie nicht nur eine bejahende Antwort auf ihre Frage, sondern auch den Namen ihres neuen Unternehmens - VEJA ist Portugiesisch und beutetet »Schau hin!«. Und genau dies tut das innovative und umweltbewusste Label auch: Getrieben von der Vision das Konsumverhalten nachhaltig zu verändern, setzt VEJA auf transparente Produktionsketten, faire Arbeitsbedingungen und umweltfreundliche Materialien.
Wie alle VEJA-Modelle wurde auch der »VEJA V-10 Leather« in Brasilien unter fairsten Arbeitsbedingungen und aus nachhaltigen Materialen hergestellt. So kommt das Obermaterial aus pflanzlich gegerbten Leder, während das Innenfutter aus biologisch abgebauter Baumwolle besteht. Auch die Sohle ist aus nachhaltigem Naturkautschuk gefertigt. Selbstverständlich braucht der »V 10 Leather« sich auch in Sachen Optik nicht zu verstecken. Das weiße Upper mit dunklerer Mittelsohle garantiert das VEJA-typische cleane Design und einen zeitlosen Look. Die Details in unterschiedlichen Rose-Tönen stellen ein optisches Highlight dar.","https://43einhalb.com/media/237386/w/240/h/158/n/237386.jpg","https://www.43einhalb.com/marken/veja"
"Puma Fast Rider R.Dassler Legacy Collection (weiß / rot)","https://www.43einhalb.com/p/puma-fast-rider-rdassler-legacy-collection-weiss-rot-436508","https://43einhalb.com/media/237377/w/616/h/370/n/puma-374877-01-fast-rider-r-dassler-legacy-col-1.jpg","Force 1 TD (weiß)","https://www.43einhalb.com/p/nike-force-1-td-weiss-251838","Nike","https://www.43einhalb.com/p/nike-force-1-td-weiss-251838","€ 89,95","Releasedate: 01.06.2020 | Online: 00:01 Uhr.
Classics are forever!
Mit dieser besonderen Kollektion würdigt Puma seinen Firmengründer und legt drei Klassiker aus mehreren Jahrzehnten Sport- und Streetwear-Geschichte wieder neu auf!
»Rudolf Dassler wollte, dass alle Athleten, die seine Produkte tragen, die Fähigkeiten eines Pumas erlangen - schnell, geschmeidig und wendig. Diese Eigenschaften hat er bei Konzeption und Produktdesign eingebracht, um Athleten erfolgreich zu machen«.
So gingen in den 60er-, 70er- und 80er-Jahren mit diesen Sportschuhen unter anderem Legenden wie die US-Sprinter Tommie Smith und John Carlos sowie die Basketball-Stars Clyde Frazier und Ralph Sampson an den Start. Längst sind aus den Sportschuhen der Vergangenheit urbane Klassiker für die Straße geworden, die in der jetzigen Neuauflage, mit Premiumleder gefertigt und mit dem Original-Branding von Rudolf Dassler versehen, auch eine Hommage an den Sport sind!","https://43einhalb.com/media/59719/w/240/h/158/n/59719.jpg","https://www.43einhalb.com/marken/puma"
"adidas SC Premiere ""Clean Classic"" (weiß / grün)","https://www.43einhalb.com/p/adidas-sc-premiere-clean-classic-weiss-gruen-430934","https://43einhalb.com/media/246258/w/616/h/370/n/adidas-fw2361-sc-premiere-1-kopie.jpg","Force 1 TD (weiß)","https://www.43einhalb.com/p/nike-force-1-td-weiss-251838","Nike","https://www.43einhalb.com/p/nike-force-1-td-weiss-251838","€ 129,95","Releasedate: 03.09.2020 | Online: 00:01 Uhr.
Leichte Sneaker im Tennis-Style sind so angesagt wie eh und je: Auch der neue adidas SC Premiere ist eindeutig vom cleanen Look der traditionellen Tennisschuhe inspiriert. Das auffällige Panel-Design verpasst der neuen Silhouette zusätzlich einen modernen Streetstyle-Look und versprüht stylischen Minimalismus.
Dieser klassische SC Premiere kommt mit einem fast komplett weißen Upper und einer gesprenkelten Midsole daher. Was diesen Schuh wirklich besonders macht, ist aber das nachhaltige Konzept, denn das Upper besteht aus mindestens 70% recycelten Materialien und die Outsole wurde aus speziellen Gummibäumen hergestellt. Darüber hinaus wurde der Schuh aus veganen Materialien produziert und besitzt mit der farblich abgesetzten Midsole ein weiteres optisches Highlight.","https://43einhalb.com/media/58939/w/240/h/158/n/58939.jpg","https://www.43einhalb.com/marken/adidas"
"adidas Newrad SPZL (braun)","https://www.43einhalb.com/p/adidas-newrad-spzl-braun-462385","https://43einhalb.com/media/247423/w/616/h/370/n/adidas-fx1050-newrad-spzl-1.jpg","","","","","€ 139,95","Releasedate: 18.09.2020 | Online: 00:01 Uhr. | Instore: Frankfurt.
Alle Jahre wieder bereitet uns adidas Spezial gleich doppelten Grund zur Freude. Denn zweimal im Jahr bringt das Team rund um Gary Aspen eine Sommer- bzw. Winterkollektion an den Start, die schon beinahe vergessene Klassiker aus den adidas-Archiven wieder auferstehen lassen mit klassischen Apparel-Essentials begeistern. Bereits seit 2014 lässt sich adidas SPZL dabei in seinen Styles von den prägendsten Subkulturen der letzten Jahrzehnte inspirieren.
Auch der erste Drop der FW-Kollektion 2020 überzeugt mal wieder auf ganzer Linie. Die diesjährige adidas SPZL Sneaker-Serie fokussiert sich diesmal auf zeitgemäße Sneaker-Hybride. So geht mit dem adidas Newrad SPZL ein brandneues Casual-Modell an den Start, das mit einem braunen Suede-Upper im Bermuda-Style und einem »Mod-Trefoil« Branding an der Seite für einen lässigen Alltags-Look sorgt.","https://43einhalb.com/media/58939/w/240/h/158/n/58939.jpg","https://www.43einhalb.com/marken/adidas"
"Nike WMNS Air Max 90 ""Ultramarine""","https://www.43einhalb.com/p/nike-wmns-air-max-90-ultramarine-416208","https://43einhalb.com/media/240793/w/616/h/370/n/nike-woman-ct1039-100-nike-w-air-max-90-1.jpg","Force 1 TD (weiß)","https://www.43einhalb.com/p/nike-force-1-td-weiss-251838","Nike","https://www.43einhalb.com/p/nike-force-1-td-weiss-251838","€ 139,95","1987 präsentierte Tinker Hatfield erstmals seinen ganzen Stolz - die sichtbare Air Unit im Air Max 1. Nur wenige Jahre später folgte der Air Max 90, dessen Air-Unit nicht nur um einiges größere war als die des 1er AM, sondern zusätzlich durch farbliche Akzente hervorgehoben wurde. Der AM90 ist eine absolute Legende unter Nike's Air-Reihe und das bereits seit 30 Jahren! Für Nike, und für uns, ein Grund dieses Jubiläum ordentlich zu feiern!
Technisch gesehen, entsprach der Air Max 90 schon damals einer ganz anderen Liga. Kreiert als Performance Laufschuh, wurde der AM90 mit einer neuen Mittelsohle aus zwei getrennten Teilen geschaffen. Das machte den Sneaker noch bequemer und garantierte zudem eine höhere Haltbarkeit. Außerdem versah Hatfield den 90er mit seinem Markenzeichen: Dem angeschnittenen Nike »Swoosh«.
Im letzten Jahr präsentierte Nike schon so einige geniale Colorways vom AM90, wie den »Mars Landing«, »Viotech«, »Vinyl« oder »Camowabb«. Anlässlich des Air Max Day 2020 bringt der Swoosh weitere grandiose Farbgebungen des Klassikers – wie diese »Washed Coral« Version für Girls!
Der Nike WMNS Air Max 90 »Ultramarine« kommt mit weißem Upper und knalligen Details, die für einen starken Retro-Look sorgen!","https://43einhalb.com/media/58940/w/240/h/158/n/58940.jpg","https://www.43einhalb.com/marken/nike"
"adidas Rivalry Low »Premium Basics Pack«","https://www.43einhalb.com/p/adidas-rivalry-low-%C2%BBpremium-basics-pack%C2%AB-432896","https://43einhalb.com/media/243825/w/616/h/370/n/adidas-fy0035-rivalry-low-1-kopie.jpg","Force 1 TD (weiß)","https://www.43einhalb.com/p/nike-force-1-td-weiss-251838","Nike","https://www.43einhalb.com/p/nike-force-1-td-weiss-251838","€ 119,95","Der adidas Rivalry ist von klassischen B-Ball-Styles der 80er Jahre inspiriert und kombiniert Retro-Design mit modernem Komfort.
Mit der Neuinterpretation des Klassikers schafft es adidas Originals wieder einmal einen erfolgreichen Court-Sneaker auf der Straße noch erfolgreicher zu machen. Der minimalistische Retrolook wird durch moderne Materialien und neueste Technologie ergänzt. Der Fortschritt zeigt sich vor allem am Leder-Obermaterial mit aufgestickten Drei Streifen und der modernen Boost Sohle, die für optimalen Komfort mit jedem Schritt sorgt!
Hier kommt der adidas Rivalry Low in einem klassischen weißen Colorway daher. Besonderheit ist hierbei die grauen Akzente und der aufgedruckte Größenlauf auf der Fersen-Partie.","https://43einhalb.com/media/58939/w/240/h/158/n/58939.jpg","https://www.43einhalb.com/marken/adidas"
"Reebok Club C Revenge (weiß / navy)","https://www.43einhalb.com/p/reebok-club-c-revenge-weiss-navy-430414","https://43einhalb.com/media/243521/w/616/h/370/n/reebok-fv9878-club-c-revenge-1-kopie.jpg","Force 1 TD (weiß)","https://www.43einhalb.com/p/nike-force-1-td-weiss-251838","Nike","https://www.43einhalb.com/p/nike-force-1-td-weiss-251838","€ 89,95","Mit seinem zeitlosen Design und der schönen Low-Cut Silhouette hat sich der Reebok Club C Revenge Mu einen Platz in der Sneaker »Hall-of-fame« verdient.
Der cleane Look in Kombination mit dem hochwertigen Materialien verleihen diesem Tennis-Klassiker einen authentisches Vintage-Flair. Auch die typische Gum-Sohle sorgt für einen weichen Kontrast zum Upper des Schuhs und macht damit den Revenge zu einem echten Hingucker!
Der Reebok Club C Revenge kommt mit einem biegen Leder-Upper und dämpfender Eva-Zwischenhohle daher. Die dunkelblauen Details runden den starken Retro-Look perfekt ab.","https://43einhalb.com/media/244388/w/240/h/158/n/244388.jpg","https://www.43einhalb.com/marken/reebok"
"Nike Jordan Zoom '92 (schwarz / rot)","https://www.43einhalb.com/p/nike-jordan-zoom-92-schwarz-rot-415230","https://43einhalb.com/media/244092/w/616/h/370/n/nike-ck9183-001-jordan-zoom-92-1-kopie.jpg","Cloud ""All Black""","https://www.43einhalb.com/p/on-cloud-all-black-106398","On","https://www.43einhalb.com/p/on-cloud-all-black-106398","€ 149,95","Releasedate: 13.08.2020 | Online: 09:00 Uhr.
Der Nike Jordan Zoom '92 erinnert optisch an die Basketballschuhe der 90er Jahre, kommt aber mit modernsten Technologien um die Ecke!
Das neue Jumpman-Modell wurde von drei Klassikern inspiriert: dem Air Jordan VII, dem Nike Air Max 180 und dem Nike Air Force 5. Der Zoom ’92 enthält sowohl visuelle als auch funktionale Details der drei Schuhe. So sind zum Beispiel die verschiedenen Schichten des Uppers vom Air Jordan 7 inspiriert, genauso wie das »9« Logo an der Ferse.
Neben der Basketballtradition stellt der Schuh den Tragekomfort in den Mittelpunkt: Der neue Jordan Zoom ’92 wurde mit der Zoom-Technologie ausgestattet und kommt mit einem sichtbaren Air-Element am Vorfuß versehen, das sich auch beim Air Max 180 und Nike Air Force 5 wiederfinden lässt.","https://43einhalb.com/media/58940/w/240/h/158/n/58940.jpg","https://www.43einhalb.com/marken/nike"
"adidas Samba Vegan (weiß / schwarz)","https://www.43einhalb.com/p/adidas-samba-vegan-weiss-schwarz-430956","https://43einhalb.com/media/243954/w/616/h/370/n/adidas-fw2427-samba-vegan-1.jpg","Force 1 TD (weiß)","https://www.43einhalb.com/p/nike-force-1-td-weiss-251838","Nike","https://www.43einhalb.com/p/nike-force-1-td-weiss-251838","€ 89,95","»Our Icons Go Vegan« - Unter diesem Motto präsentiert adidas Originals einige seiner absoluten Klassiker im neuen Remake, das komplett auf tierische Materialien verzichtet und somit zu 100% vegan ist. Ein starkes Statement für eine bessere Zukunft!
Als Teil der »Vegan Icons« geht auch der adidas Samba an den Start und begeistert dabei weiterhin mit seiner schlanken und zeitlosen Silhouette! Das Synthetik-Upper im originalen Samba-Design besteht aus recyceltem Materialien und kommt mit einer nützlichen PU-Beschichtung. Dabei bleibt auch die vegane Version des Klassikers dem ursprünglichen Fußball-Style treu und kommt selbstverständlich auch mit dem T-förmigen Zehenbereich als typisches Signature-Detail daher. Der adidas Samba »Vegan« begeistert als vegane Alternative zum Klassiker und verzichtet dabei vom Material, über die Farbe bis hin zum Kleber komplett auf tierische Materialien.","https://43einhalb.com/media/58939/w/240/h/158/n/58939.jpg","https://www.43einhalb.com/marken/adidas"
"New Balance ML574SKA (schwarz / gelb)","https://www.43einhalb.com/p/new-balance-ml574ska-schwarz-gelb-408477","https://43einhalb.com/media/238617/w/616/h/370/n/nb-819431-60-8-ml574ska-1.jpg","Cloud ""All Black""","https://www.43einhalb.com/p/on-cloud-all-black-106398","On","https://www.43einhalb.com/p/on-cloud-all-black-106398","€ 89,95","Wenn man von New Balance spricht, kommt zwangsläufig der 574er zur Sprache. Es ist das seit 1988 immer leuchtende Aushängeschild der Laufschuhmarke, welches Liebhaber als auch New Balance Neulinge gleichermaßen begeistert!
Ausgestattet mit dem ENCAP-System, welches zusätzlich Stabilität und Dämpfung bringt, war der New Balance 574 viele Jahre einer der beliebtesten Laufschuhe. Heute ist er der solideste Lifestyle-Sneaker im New Balance Sortiment, nicht zuletzt weil er den Spagat zwischen Sportlichkeit und Casual wie kaum ein anderer Sneaker beherrscht.
Hier kommt der New Balance ML574SKA mit einem schönen schlichten schwarzen Upper daher, dass durch die gelben Details nochmals hervorgehoben wird.","https://43einhalb.com/media/212737/w/240/h/158/n/212737.jpg","https://www.43einhalb.com/marken/new-balance"
"On Cloudswift (grau / weiß)","https://www.43einhalb.com/p/on-cloudswift-grau-weiss-435560","https://43einhalb.com/media/240470/w/616/h/370/n/on-3199635-cloudswift-1.jpg","SK8-Lo (gelb)","https://www.43einhalb.com/p/vans-sk8-lo-gelb-426860","Vans","https://www.43einhalb.com/p/vans-sk8-lo-gelb-426860","€ 159,95","Erobere die Stadt in einem leichten Runner, der vollen Schutz vor der Straße bietet.
Wer in urbaner Umgebung laufen will, muss einigen Belastungen standhalten. Mit dem Cloudswift ist das kein Problem! Der Schuh kommt mit Helion™-Superfoam für maximale Dämpfung und Komfort auf jedem Kilometer. Hier trifft ein geringes Gewicht auf großartige Energierückgewinnung und Langlebigkeit.
Im Sommer heizen sich die Straßen auf, doch mit dem Cloudswift bleibst du trotzdem cool, denn der Innenschuh wurde aus speziellem Mesh gefertigt und lässt deinen Fuß atmen. Außerdem trifft Aufprallschutz auf robuste, verstärkende Gummi-Elemente, so dass du auch auf nassen Straßen eine optimale Traktion hast.
On top ist das mechanische seitliche Band stabil und doch dehnbar. Es bietet dir sanften Support am Mittelfuß, wenn du einen Sprint durch die Stadt einlegst. Außerdem kannst du hier deine Schnürbänder indivudell fixieren.","https://43einhalb.com/media/196879/w/240/h/158/n/196879.jpg","https://www.43einhalb.com/marken/on"
"Birkenstock Amsterdam BZ Anthrazit VEG (grau)","https://www.43einhalb.com/p/birkenstock-amsterdam-bz-anthrazit-veg-grau-438622","https://43einhalb.com/media/245538/w/616/h/370/n/birkenstock-0559123-amsterdam-bs-1-kopie.jpg","Cloud Hi (grau)","https://www.43einhalb.com/p/on-cloud-hi-grau-362677","On","https://www.43einhalb.com/p/on-cloud-hi-grau-362677","€ 54,95","Manchmal ist weniger einfach mehr! Getreu dieser Devise besticht der BIRKENSTOCK Amsterdam durch seine cleane und schlichte Optik. Der ausgedehnte Schaft des Clogs verleiht dem Fuß einen sicheren Halt und sorgt gleichzeitig für Komfort. Die beliebte Sandale wurde mit einem Material-Update versehen und ist ab sofort in einer veganen Version erhältlich. Sie ist komplett frei von tierischen Bestandteilen, was durch unabhängige Prüflabore belegt wurde. Die farblich abgestimmte Laufsohle rundet das raffinierte Erscheinungsbild des Schuhs ab. Zusätzlich besteht das Obermaterial aus einem weichen Synthetikfilz, welches aus recycelten Plastikflaschen gewonnen wurde.","https://43einhalb.com/media/246935/w/240/h/158/n/246935.jpg","https://www.43einhalb.com/marken/birkenstock"
"Birkenstock Amsterdam FE Blue VEG (blau)","https://www.43einhalb.com/p/birkenstock-amsterdam-fe-blue-veg-blau-438560","https://43einhalb.com/media/245533/w/616/h/370/n/birkenstock-1017697-amsterdam-bs-1-kopie.jpg","M Clifton 7 (dunkelblau / grün)","https://www.43einhalb.com/p/hoka-one-one-m-clifton-7-dunkelblau-gruen-436120","HOKA ONE ONE","https://www.43einhalb.com/p/hoka-one-one-m-clifton-7-dunkelblau-gruen-436120","€ 54,95","Manchmal ist weniger einfach mehr! Getreu dieser Devise besticht der BIRKENSTOCK Amsterdam durch seine cleane und schlichte Optik. Der ausgedehnte Schaft des Clogs verleiht dem Fuß einen sicheren Halt und sorgt gleichzeitig für Komfort. Die beliebte Sandale wurde mit einem Material-Update versehen und ist ab sofort in einer veganen Version erhältlich. Sie ist komplett frei von tierischen Bestandteilen, was durch unabhängige Prüflabore belegt wurde. Die farblich abgestimmte Laufsohle rundet das raffinierte Erscheinungsbild des Schuhs ab. Zusätzlich besteht das Obermaterial aus einem weichen Synthetikfilz, welches aus recycelten Plastikflaschen gewonnen wurde.","https://43einhalb.com/media/246935/w/240/h/158/n/246935.jpg","https://www.43einhalb.com/marken/birkenstock"
"Autry Medalist (weiß / dunkelblau)","https://www.43einhalb.com/p/autry-medalist-weiss-dunkelblau-460847","https://43einhalb.com/media/248506/w/616/h/370/n/autry-aulmln18-1.jpg","V-10 - B-MESH (beige / weiß)","https://www.43einhalb.com/p/veja-v-10%09-b-mesh-beige-weiss-392484","VEJA","https://www.43einhalb.com/p/veja-v-10%09-b-mesh-beige-weiss-392484","€ 139,95","BITTE BEACHTEN: Uns ist aufgefallen, dass der Medalist von Autry eine halbe bis ganze Nummer Größer ausfällt. Solltet Ihr also zwischen zwei Größen stehen, entscheidet Euch lieber für die kleinere.
Gegründet 1982 in Dallas (Texas), war Autry in den 80er Jahren eine der angesagtesten Sport-Brands auf dem US-Markt. Damals war das Label auf Tennis, Running und Aerobic Schuhe ausgerichtet und erlangte dank diverser Innovationen im Bereich Design und Technologie sowie einiger Auszeichnungen große Bekanntheit.
Spätestens seit 2019 sorgt Autry mit der originalgetreuen Neuauflage des prämierten »Medalist« Sneaker erneut für Furore – und dieses Mal nicht nur in Nordamerika. An dieser Stelle feiern wir es sehr, dass wir ab sofort »den Schuh mit der amerikanischen Flagge« auch bei uns im Shop begrüßen dürfen!
Hier zeigt sich Autry‘s Signature Schuh »Medalist« im klassichen Tennis-Look. Die farblichen Akzente, das typische Autry-Branding mit US-Flagge und die abgedunkelte Vintage-Sohle sorgen für eine große Portion an Retro-Charme und bleiben der unvergleichlichen Autry-Heritage treu.","https://43einhalb.com/media/250603/w/240/h/158/n/250603.jpg","https://www.43einhalb.com/marken/autry"
