"Sneaker_name","Sneaker_url","Sneaker_img","Sneaker_title","Sneaker_title_url","Sneaker_brand","Sneaker_brand_url","Sneaker_price","Sneaker_description","Sneaker_brand_img","Sneaker_brand_img_url"
"Vans x LQQK Studio OG Mule LX (grün / weiß)","https://www.43einhalb.com/p/vans-x-lqqk-studio-og-mule-lx-gruen-weiss-465509","https://43einhalb.com/media/253160/w/616/h/370/n/vans-vn0a5fc22t11-ua-og-og-mule-lx-1.jpg","Atacama (olive / schwarz)","https://www.43einhalb.com/p/birkenstock-atacama-olive-schwarz-400724","Birkenstock","https://www.43einhalb.com/p/birkenstock-atacama-olive-schwarz-400724","€ 119,95","Releasedate: 21.11.2020 | Online: 00:01 Uhr.
Mit der erneuten Kollaboration zwischen dem Vans Vault und dem amerikanischen Künstler-Kollektiv LQQK Studio soll erneut ein Zeichen der Kreativität gesetzt werden, während die Capsule Kollektion gleichzeitig eine Huldigung an klassische Workwear Kleidung ist.
Das vom New Yorker Creative Head Alex Dondero zusammen mit Paul Bryant, Max Feuer, Martin Davis und Joe Garvey gegründete LQQK Studio arbeitet stets mit anderen Partnern zusammen, um ihrer Kreativität Ausdruck zu verleihen. An den Erfolg vorheriger Zusammenarbeiten will das Duo jetzt anknüpfen und so sagt Alex Dondero: „Wir wollen immer Produkte kreieren, die kurzlebige Modetrends überleben. Die Verwendung von Materialien die sonst für Workwear benutzt werden, bieten sich hervorragend dafür an.“
Zur Holiday-Season 2020 bringt Vans Vault in Kollaboration mit LQQK Studio eine Capsule Kollektion bestehend aus sechs Schuhen heraus, die alle mit dem »Circle V« versehen sind, was bei Fans der Marke bereits 2018 für große Begeisterung sorgte. Das Footwear Line-Up wird von einem OG Style 17 Mule LX in »Honey Comb« und einem OG Chukka LX in »Burgundy« angeführt, die beide sowohl farblich, als auch material-technisch ganz im Zeichen von Workwear stehen. Die beiden Modelle gibt es ebenfalls im »Splatter Ink« und »Natural« Colorway.","https://43einhalb.com/media/103047/w/240/h/158/n/103047.jpg","https://www.43einhalb.com/marken/vans"
"adidas Rivalry Low W (weiß / schwarz / grün)","https://www.43einhalb.com/p/adidas-rivalry-low-w-weiss-schwarz-gruen-433494","https://43einhalb.com/media/250126/w/616/h/370/n/adidas-woman-fy6973-rivalry-low-1-kopie.jpg","Force 1 TD (weiß)","https://www.43einhalb.com/p/nike-force-1-td-weiss-251838","Nike","https://www.43einhalb.com/p/nike-force-1-td-weiss-251838","€ 89,95","Der adidas Rivalry ist von klassischen B-Ball-Styles der 80er Jahre inspiriert und kombiniert Retro-Design mit modernem Komfort.
Mit der Neuinterpretation des Klassikers schafft es adidas Originals wieder einmal einen erfolgreichen Court-Sneaker auf der Straße noch erfolgreicher zu machen. Der minimalistische Retrolook wird durch moderne Materialien und neueste Technologie ergänzt. Der Fortschritt zeigt sich vor allem am Leder-Obermaterial mit aufgestickten Drei Streifen und der lässigen Gummi-Cupsohle.
Hier kommt der adidas Originals Rivalry Low in einem cleanen all-over weißen Colorway daher, der durch das schwarze Drei-Streifen Branding und den auffälligen pinken und neon-gelben Details auf jeden Fall für einen Eye-Catcher an Euren Füßen sorgt!","https://43einhalb.com/media/58939/w/240/h/158/n/58939.jpg","https://www.43einhalb.com/marken/adidas"
"New Balance ML574SSJ (gelb)","https://www.43einhalb.com/p/new-balance-ml574ssj-gelb-406307","https://43einhalb.com/media/250070/w/616/h/370/n/new-balance-819471-60-7-ml574ssj-1.jpg","Classic Leather Legacy (orange / gelb / blau)","https://www.43einhalb.com/p/reebok-classic-leather-legacy-orange-gelb-blau-433572","Reebok","https://www.43einhalb.com/p/reebok-classic-leather-legacy-orange-gelb-blau-433572","€ 89,95","Wenn man von New Balance spricht, kommt zwangsläufig der 574er zur Sprache. Es ist das seit 1988 immer leuchtende Aushängeschild der Laufschuhmarke, welches Liebhaber als auch New Balance Neulinge gleichermaßen begeistert!
Ausgestattet mit dem ENCAP-System, welches zusätzlich Stabilität und Dämpfung bringt, war der New Balance 574 viele Jahre einer der beliebtesten Laufschuhe. Heute ist er der solideste Lifestyle-Sneaker im New Balance Sortiment, nicht zuletzt weil er den Spagat zwischen Sportlichkeit und Casual wie kaum ein anderer Sneaker beherrscht.
Hier kommt der New Balance ML574SSJ mit einem auffälligem Upper in strahlendem gelb und hellgrünen Details daher. Die weiße Zwischensohle und die schwarze Außensohle runden den starken Retro-Look perfekt ab.","https://43einhalb.com/media/212737/w/240/h/158/n/212737.jpg","https://www.43einhalb.com/marken/new-balance"
"Vans x MoMA ComfyCush Era","https://www.43einhalb.com/p/vans-x-moma-comfycush-era-424834","https://43einhalb.com/media/248806/w/616/h/370/n/vans-vn0a3wm91pj1-ua-comfycush-era-1.jpg","WL574ANA (schwarz / grau / leo)","https://www.43einhalb.com/p/new-balance-wl574ana-schwarz-grau-leo-408847","New Balance","https://www.43einhalb.com/p/new-balance-wl574ana-schwarz-grau-leo-408847","€ 84,95","Releasedate: 30.09.2020 | Online: 00:01 Uhr.
Für die nächste Zusammenarbeit hat sich die kalifornische Skate-Marke Vans keinen geringeren Partner als das in New-York ansässige MoMA (Museum of Modern Art) ausgewählt, um eine Kollektion bestehend aus diversen Footwear- und Apparel-Pieces im Design berühmter Künstler wie Salvador Dali, Vasily Kandinsky, Claude Monet, Edvard Munch und vielen weiteren zu launchen.
Zu dieser Kollektion gehört auch der Comfy Cush Era, der hier in einem auffälligen Schachbrettmuster, dem klassischen Vans-Branding am Heel und der »ComfyCush«-Dämpfung daher kommt.
Mit der »ComfyCush«-Technologie verleiht Vans seinen klassischen Silhouetten - so auch dem Era Modell - einen komplett neuen Tragekomfort. Der Schuh bekommt einen einzigartigen Fit und man hat das Gefühl wie auf einer Wolke zu laufen. Die Rubber-Outsole in Verbindung mit der neuen »ComfyCush«-Konstruktion bietet die bestmögliche Kombination aus Komfort, Grip und klassischem Style.","https://43einhalb.com/media/103047/w/240/h/158/n/103047.jpg","https://www.43einhalb.com/marken/vans"
"VEJA Urca CWL (weiß / beige)","https://www.43einhalb.com/p/veja-urca-cwl-weiss-beige-440192","https://43einhalb.com/media/248716/w/616/h/370/n/veja-uc072426-urca-cwl-1-kopie.jpg","Force 1 TD (weiß)","https://www.43einhalb.com/p/nike-force-1-td-weiss-251838","Nike","https://www.43einhalb.com/p/nike-force-1-td-weiss-251838","€ 129,95","Nachhaltig. Fair. Zeitlos. - »Sneakers that are made differently«!
Seit der Unternehmensgründung 2005 stellt VEJA erfolgreich unter Beweis, dass Stilbewusstsein und Nachhaltigkeit auch in der Sneaker-Branche Hand in Hand gehen können. Dabei ist die Idee hinter einem Paar VEJA Sneaker genau so simpel wie genial: Schlüpfe mit einem Fuß in überzeugendes Design und übernehme mit dem anderen soziale Verantwortung!
Doch erstmal von vorne: Im Jahr 2005 stellten sich die beiden französischen VEJA-Gründer Sébastien Kopp und François-Ghislain Morillion eine folgenreiche Frage: »Ist eine andere Welt möglich?« . Um eine Antwort auf diese entscheidende Frage zu finden, begaben sich die Zwei auf eine lange Reise, auf der sie die Entwicklung und Produktion von Turnschuhen sowie die entstehenden Rohstoffpreise nachvollziehen und verstehen wollten. Während ihrer Reise fanden sie nicht nur eine bejahende Antwort auf ihre Frage, sondern auch den Namen ihres neuen Unternehmens - VEJA ist Portugiesisch und beutetet »Schau hin!«. Und genau dies tut das innovative und umweltbewusste Label auch: Getrieben von der Vision das Konsumverhalten nachhaltig zu verändern, setzt VEJA auf transparente Produktionsketten, faire Arbeitsbedingungen und umweltfreundliche Materialien.
Mit der brandneuen Urca-Silhouette bringt Veja einen neuen Sneaker auf den Markt, der in Sachen Nachhaltigkeit völlig neue Maßstäbe setzt. Der Veja Urca besteht nämlich aus Lebensmittelabfällen und ist somit biologisch abbaubar. Als überarbeitete und komplett vegane Version des beliebten V12-Trainers überzeugt auch der Ucar im Veja-typischen Design mit beigen Details und einer abgedunkelten Midsole. Neben dem zeitlosen und modernen Look besticht der Veja Urca jedoch in erster Linie in Puncto Nachhaltigkeit. Als bisher umweltbewusstester Sneaker im Veja-Sortiment wird der Urca zu 50% aus Abfällen der Lebensmittelindustrie hergestellt und auch sonst besteht das neue Modell ausschließlich aus erneuerbaren land-, maritimen und forstwirtschaftlichen Materialien.","https://43einhalb.com/media/237386/w/240/h/158/n/237386.jpg","https://www.43einhalb.com/marken/veja"
"Nike Jordan Delta (schwarz / pink)","https://www.43einhalb.com/p/nike-jordan-delta-schwarz-pink-447754","https://43einhalb.com/media/252549/w/616/h/370/n/nike-cd6109-053-jordan-delta-1.jpg","Cloud ""All Black""","https://www.43einhalb.com/p/on-cloud-all-black-106398","On","https://www.43einhalb.com/p/on-cloud-all-black-106398","€ 129,95","Releasedate: 15.11.2020 | Online: 09:00 Uhr.
Mit dem Jordan-Delta bringt die Brand eine weitere Silhouette an den Start, die Handwerkskunst aus hochwertigen Materialien mit den neuesten Technologien verbindet.
Der Sneaker kommt mit einem luftigen Mesh-Upper, das durch Suede Overlays die benötigte Stabilität verliehen bekommt. Für das Lining haben sich die Designer ebenfalls etwas besonderes einfallen lassen: Im kompletten Inneren des Schuhs befindet sich keine einzige Naht. So kannst du den Sneaker sorglos den ganzen Tag tragen, ohne dass dich unangenehme Stellen drücken. Für das Nonplusultra an Komfort sorgen die zusätzlich gepolsterte Tongue und der rote Heel Loop.
Die Sohle besteht komplett aus Nike-React-Foam und sorgt somit für den optimalen Komfort. Die abstrakte Form des Schuhs sorgt für einen sicheren Halt und ausreichend Flexibilität - den ganzen Tag lang!","https://43einhalb.com/media/58940/w/240/h/158/n/58940.jpg","https://www.43einhalb.com/marken/nike"
"Vans x LQQK Studio OG Chukka Boot LX (beige)","https://www.43einhalb.com/p/vans-x-lqqk-studio-og-chukka-boot-lx-beige-465575","https://43einhalb.com/media/253150/w/616/h/370/n/vans-vn0a5fbv2sp1-ua-og-chukka-boot-lx-1.jpg","V-10 - B-MESH (beige / weiß)","https://www.43einhalb.com/p/veja-v-10%09-b-mesh-beige-weiss-392484","VEJA","https://www.43einhalb.com/p/veja-v-10%09-b-mesh-beige-weiss-392484","€ 149,95","Releasedate: 21.11.2020 | Online: 00:01 Uhr.
Mit der erneuten Kollaboration zwischen dem Vans Vault und dem amerikanischen Künstler-Kollektiv LQQK Studio soll erneut ein Zeichen der Kreativität gesetzt werden, während die Capsule Kollektion gleichzeitig eine Huldigung an klassische Workwear Kleidung ist.
Das vom New Yorker Creative Head Alex Dondero zusammen mit Paul Bryant, Max Feuer, Martin Davis und Joe Garvey gegründete LQQK Studio arbeitet stets mit anderen Partnern zusammen, um ihrer Kreativität Ausdruck zu verleihen. An den Erfolg vorheriger Zusammenarbeiten will das Duo jetzt anknüpfen und so sagt Alex Dondero: „Wir wollen immer Produkte kreieren, die kurzlebige Modetrends überleben. Die Verwendung von Materialien die sonst für Workwear benutzt werden, bieten sich hervorragend dafür an.“
Zur Holiday-Season 2020 bringt Vans Vault in Kollaboration mit LQQK Studio eine Capsule Kollektion bestehend aus sechs Schuhen heraus, die alle mit dem »Circle V« versehen sind, was bei Fans der Marke bereits 2018 für große Begeisterung sorgte. Das Footwear Line-Up wird von einem OG Style 17 Mule LX in »Honey Comb« und einem OG Chukka LX in »Burgundy« angeführt, die beide sowohl farblich, als auch material-technisch ganz im Zeichen von Workwear stehen. Die beiden Modelle gibt es ebenfalls im »Splatter Ink« und »Natural« also naturbelassenen Colorway.","https://43einhalb.com/media/103047/w/240/h/158/n/103047.jpg","https://www.43einhalb.com/marken/vans"
"Vans x LQQK Studio OG Chukka Boot LX (schwarz / grau)","https://www.43einhalb.com/p/vans-x-lqqk-studio-og-chukka-boot-lx-schwarz-grau-465553","https://43einhalb.com/media/253155/w/616/h/370/n/vans-vn0a5fbv2sq1-ua-og-chukka-boot-lx-1-kopie.jpg","Cloud ""All Black""","https://www.43einhalb.com/p/on-cloud-all-black-106398","On","https://www.43einhalb.com/p/on-cloud-all-black-106398","€ 149,95","Releasedate: 21.11.2020 | Online: 00:01 Uhr.
Mit der erneuten Kollaboration zwischen dem Vans Vault und dem amerikanischen Künstler-Kollektiv LQQK Studio soll erneut ein Zeichen der Kreativität gesetzt werden, während die Capsule Kollektion gleichzeitig eine Huldigung an klassische Workwear Kleidung ist.
Das vom New Yorker Creative Head Alex Dondero zusammen mit Paul Bryant, Max Feuer, Martin Davis und Joe Garvey gegründete LQQK Studio arbeitet stets mit anderen Partnern zusammen, um ihrer Kreativität Ausdruck zu verleihen. An den Erfolg vorheriger Zusammenarbeiten will das Duo jetzt anknüpfen und so sagt Alex Dondero: „Wir wollen immer Produkte kreieren, die kurzlebige Modetrends überleben. Die Verwendung von Materialien die sonst für Workwear benutzt werden, bieten sich hervorragend dafür an.“
Zur Holiday-Season 2020 bringt Vans Vault in Kollaboration mit LQQK Studio eine Capsule Kollektion bestehend aus sechs Schuhen heraus, die alle mit dem »Circle V« versehen sind, was bei Fans der Marke bereits 2018 für große Begeisterung sorgte. Das Footwear Line-Up wird von einem OG Style 17 Mule LX in »Honey Comb« und einem OG Chukka LX in »Burgundy« angeführt, die beide sowohl farblich, als auch material-technisch ganz im Zeichen von Workwear stehen. Die beiden Modelle gibt es ebenfalls im »Splatter Ink« und »Natural« Colorway.","https://43einhalb.com/media/103047/w/240/h/158/n/103047.jpg","https://www.43einhalb.com/marken/vans"
"Karhu Aria 95 ""Hockey Pack"" (schwarz / lila)","https://www.43einhalb.com/p/karhu-aria-95-hockey-pack-schwarz-lila-403879","https://43einhalb.com/media/249098/w/616/h/370/n/karhu-f803069-aria-1.jpg","Cloud ""All Black""","https://www.43einhalb.com/p/on-cloud-all-black-106398","On","https://www.43einhalb.com/p/on-cloud-all-black-106398","€ 129,95","Releasedate: 02.10.2020 | Online: 00:01 Uhr. | Instore: Frankfurt.
Das Eis-Hockey in Finnland mehr als nur eine Sportart ist, dürfte den meisten Leuten schon mit Blick auf die geografische Lage des Landes auffallen!
Da der finnische Sneaker-Hersteller Karhu als ehemaliger Hockey-Equipment Hersteller und Sponsor der Eishockey-Legende Antti-Jussi Tiitola gerade zu dafür prädestiniert ist, eine Homage an den Volkssport Nr. 1 des nordischen Landes zu senden, zelebriert man jetzt erneut das berühmte »Hockey Bären« - Logo im Stile längst vergangener Tage auf dem Fusion 2.0, dem Aria 95, dem Legacy 96 und dem Synchron Classic.
Auch die legendäre Aria 95 Silhouette darf natürlich in diesem Line-Up nicht fehlen! Der schlichte Colorway überzeugt durch das harmonierende Farbspiel der fliederfarbenen Mesh-Panels in Kombination mit der beigen Midsole und einem gleichfarbigen Schaft. Die hochwertigen, schwarzen Suede Overlays runden den Look dieses Sneakers perfekt ab und versorgen ihn obendrein mit genügend Stabilität und Robustheit.","https://43einhalb.com/media/106028/w/240/h/158/n/106028.jpg","https://www.43einhalb.com/marken/karhu"
"Nike WMNS Waffle Racer 2X (weiß / beige / grün)","https://www.43einhalb.com/p/nike-wmns-waffle-racer-2x-weiss-beige-gruen-452798","https://43einhalb.com/media/248083/w/616/h/370/n/nike-woman-dc4467-100-waffle-racer-2x-1-kopie.jpg","Force 1 TD (weiß)","https://www.43einhalb.com/p/nike-force-1-td-weiss-251838","Nike","https://www.43einhalb.com/p/nike-force-1-td-weiss-251838","€ 99,95","Inspiriert vom Design des legendären OG Waffle Trainers, dessen Sohle einst von Bill Bowerman höchstpersönlich von Hand in einem Waffeleisen gegossen wurde, kommt jetzt der Waffle Racer 2X daher.
Diese exklusiv für unsere Mädels designte Silhouette im Prototyp-Design überzeugt durch das leichte Synthetik Upper, auf dem sich zahlreiche Suede Overlays befinden, welche den Schuh mit ausreichend Stabilität und Robustheit versorgen. Abgerundet wird dieser Sneaker im DIY-Look durch den aufgesetzten Swoosh und die gelben Akzente, die den schlichten Colorway noch einmal farblich hervorheben.","https://43einhalb.com/media/58940/w/240/h/158/n/58940.jpg","https://www.43einhalb.com/marken/nike"
"Nike WMNS Waffle Racer 2X (weiß / beige / grün)","https://www.43einhalb.com/p/nike-wmns-waffle-racer-2x-weiss-beige-gruen-452798","","","","","","","","",""
"Reebok Club C Revenge (weiß / beige / rot)","https://www.43einhalb.com/p/reebok-club-c-revenge-weiss-beige-rot-458124","https://43einhalb.com/media/253824/w/616/h/370/n/reebok-fy9418-club-c-revenge-1.jpg","Force 1 TD (weiß)","https://www.43einhalb.com/p/nike-force-1-td-weiss-251838","Nike","https://www.43einhalb.com/p/nike-force-1-td-weiss-251838","€ 89,95","Mit seinem zeitlosen Design und der schönen Low-Cut Silhouette hat sich der Reebok Club C Revenge einen Platz in der Sneaker »Hall-of-fame« verdient.
Der cleane Look in Kombination mit dem hochwertigen Materialien verleihen diesem Tennis-Klassiker einen authentisches Vintage-Flair. Auch die typische Gum-Sohle sorgt für einen weichen Kontrast zum Upper des Schuhs und macht damit den Revenge zu einem echten Hingucker!
Der Reebok Club C Revenge kommt mit einem weißen Leder-Upper und beigen Suede Mudguard daher und wird durch die roten Details perfekt in Szene gesetzt.","https://43einhalb.com/media/244388/w/240/h/158/n/244388.jpg","https://www.43einhalb.com/marken/reebok"
"Puma Basket VTG (weiß / lila)","https://www.43einhalb.com/p/puma-basket-vtg-weiss-lila-472993","https://43einhalb.com/media/251311/w/616/h/370/n/puma-woman-374922-04-basket-vtg-1.jpg","Force 1 TD (weiß)","https://www.43einhalb.com/p/nike-force-1-td-weiss-251838","Nike","https://www.43einhalb.com/p/nike-force-1-td-weiss-251838","€ 89,95","Releasedate: 01.11:2020 | Online: 00:01 Uhr.
Zum Ende des Jahres haben wir noch ein echtes Highlight für Euch im Repertoire - die Rückkehr des Puma Baskets VTG als ein-zu-eins Remake der Originalversion! Als Basketball-Version des legendären Puma Suede schrieb das Kult-Modell Geschichte in Zeiten, als die NBA mit ihren strengen Regeln bezüglich der Sportschuhe längst nicht so war, wie wir sie heute kennen. Nach seinem Debüt auf dem Basketball-Parkett dauerte es auch nicht mehr lange, bis der Basket auf der Straße adaptiert wurde und zunehmend von B-Boys und Sprayern getragen wurde.
Im Jahr 2021 feiert der Kult-Schuh bereits sein 50. Jubiläum, und um den Geburtstag gebührend einzuleiten geht es jetzt schon mit den ersten Releases los. Wie schon damals überzeugt der Puma Basket VTG durch seine Robustheit und sein cleanes Erscheinungsbild. Der Sneaker kommt mit einem Upper aus Glattleder daher, farblich abgesetzten Puma Streifen aus Velour-Leder und einem Lining, das ebenfalls aus Leder besteht - Eigenschaften, die den Basket zum perfekten Alltags-Begleiter machen. Natürlich darf getreu der OG-Version das legendäre Puma Gold-Foil Branding nicht fehlen!","https://43einhalb.com/media/59719/w/240/h/158/n/59719.jpg","https://www.43einhalb.com/marken/puma"
"Puma Basket VTG (schwarz / weiß)","https://www.43einhalb.com/p/puma-basket-vtg-schwarz-weiss-472957","https://43einhalb.com/media/251316/w/616/h/370/n/puma-374922-03-basket-vtg-1.jpg","Cloud ""All Black""","https://www.43einhalb.com/p/on-cloud-all-black-106398","On","https://www.43einhalb.com/p/on-cloud-all-black-106398","€ 89,95","Releasedate: 01.11:2020 | Online: 00:01 Uhr.
Zum Ende des Jahres haben wir noch ein echtes Highlight für Euch im Repertoire - die Rückkehr des Puma Baskets VTG als ein-zu-eins Remake der Originalversion! Als Basketball-Version des legendären Puma Suede schrieb das Kult-Modell Geschichte in Zeiten, als die NBA mit ihren strengen Regeln bezüglich der Sportschuhe längst nicht so war, wie wir sie heute kennen. Nach seinem Debüt auf dem Basketball-Parkett dauerte es auch nicht mehr lange, bis der Basket auf der Straße adaptiert wurde und zunehmend von B-Boys und Sprayern getragen wurde.
Im Jahr 2021 feiert der Kult-Schuh bereits sein 50. Jubiläum, und um den Geburtstag gebührend einzuleiten geht es jetzt schon mit den ersten Releases los. Wie schon damals überzeugt der Puma Basket VTG durch seine Robustheit und sein cleanes Erscheinungsbild. Der Sneaker kommt mit einem Upper aus Glattleder daher, farblich abgesetzten Puma Streifen aus Velour-Leder und einem Lining, das ebenfalls aus Leder besteht - Eigenschaften, die den Basket zum perfekten Alltags-Begleiter machen. Natürlich darf getreu der OG-Version das legendäre Puma Gold-Foil Branding nicht fehlen!","https://43einhalb.com/media/59719/w/240/h/158/n/59719.jpg","https://www.43einhalb.com/marken/puma"
"adidas Superstar Vegan (schwarz / weiß)","https://www.43einhalb.com/p/adidas-superstar-vegan-schwarz-weiss-430866","https://43einhalb.com/media/244403/w/616/h/370/n/adidas-fw2296-superstar-vegan-1-kopie.jpg","Cloud ""All Black""","https://www.43einhalb.com/p/on-cloud-all-black-106398","On","https://www.43einhalb.com/p/on-cloud-all-black-106398","€ 99,95","»Our Icons Go Vegan« - Unter diesem Motto präsentiert adidas Originals einige seiner absoluten Klassiker im neuen Remake, das komplett auf tierische Materialien verzichtet und somit zu 100% vegan ist. Ein starkes Statement für eine bessere Zukunft!
Als unangefochtene adidas-Legende darf selbstverständlich auch der Superstar in der »Vegan Icons«-Kollektion nicht fehlen. Das schlichte, schwarze Synthetik-Upper besteht aus recyceltem Materialien und kommt mit einer nützlichen PU-Beschichtung. Der adidas Superstar »Vegan« begeistert als vegane Alternative zum Klassiker und verzichtet dabei vom Material, über die Farbe bis hin zum Kleber komplett auf tierische Materialien.","https://43einhalb.com/media/58939/w/240/h/158/n/58939.jpg","https://www.43einhalb.com/marken/adidas"
"Vans Old Skool LX OG (schwarz / weiß)","https://www.43einhalb.com/p/vans-old-skool-lx-og-schwarz-weiss-394649","https://43einhalb.com/media/244071/w/616/h/370/n/vans-vn0a4p3xoiu1-old-skool-lx-1-kopie.jpg","Cloud ""All Black""","https://www.43einhalb.com/p/on-cloud-all-black-106398","On","https://www.43einhalb.com/p/on-cloud-all-black-106398","€ 84,95","Der Vans Old Skool ist das erste Modell der Marke auf welchem der klassische Vans-Seitenstreifen zu sehen war, zweifelsohne ein Symbol für die Welt des Skateboarding schlechthin.
Der Sneaker überzeugt durch seinen schlichten, zeitlosen Stil, als auch durch Funktionalität. Er passt sowohl zum locker-schicken Outfit, hat sich aber ebenfalls bei der Skate-Community wegen seiner hohen Strapazierfähigkeit bewährt.
Hier kommt der Vans Old Skool LX OG kommt hier in seinem klassischen Schwarzen Colorway daher. Die Weißen Details runden den »to go« Sneaker perfekt ab.","https://43einhalb.com/media/103047/w/240/h/158/n/103047.jpg","https://www.43einhalb.com/marken/vans"
"Vans SK8-Lo (gelb)","https://www.43einhalb.com/p/vans-sk8-lo-gelb-426860","https://43einhalb.com/media/243958/w/616/h/370/n/vans-vn0a4uuk24k1-sk8-low-1.jpg","SK8-Lo (gelb)","","Vans","","€ 74,95","SUEDE-CANVAS-VIRGIN - Upper Material Leather 66,29%; Upper Material Textile 33,71%; Upper Material Rubber Plastic 0%; - Leather","https://43einhalb.com/media/103047/w/240/h/158/n/103047.jpg","https://www.43einhalb.com/marken/vans"
"ASICS SportStyle Gel-Kayano 5 OG (weiß / türkis / orange)","https://www.43einhalb.com/p/asics-sportstyle-gel-kayano-5-og-weiss-tuerkis-orange-405109","https://43einhalb.com/media/243944/w/616/h/370/n/asics-1021a280-102-gel-kayano-5-og-1.jpg","Force 1 TD (weiß)","https://www.43einhalb.com/p/nike-force-1-td-weiss-251838","Nike","https://www.43einhalb.com/p/nike-force-1-td-weiss-251838","€ 139,95","Gel-Kayano – Dieser Name steht bei ASICS Sportstyle für das Non-Plus-Ultra, für den vollendeten Performance Laufschuh.
Bisher brachte der japanische Sportartikelhersteller in dieser Serie 25 Modelle auf den Markt und ein Ende ist noch lange nicht in Sicht. Seinen Anfang nahm diese Erfolgsstory im Jahr 1993. Der Original Gel-Kayano wurde damals für ambitionierte Langstreckenläufer konzipiert und deshalb mit gleich zwei GEL-Einheiten ausgerüstet: Ein Theta GEL-Pad am Hinterfuß und P-GEL am Vorderfuß. Zudem kommt der Sneaker mit einer Dual-Density Mittelsohle, kühlendem Mesh-Material und einer flexiblen Außensohle.
Dank seiner überzeugenden Performance und seinem ikonischen Design hat der Gel-Kayano über die Jahre hinweg auch als beliebte Lifestyle-Silhouette von sich Reden gemacht und immer wieder mit neuen Looks für Aufsehen gesorgt.","https://43einhalb.com/media/213728/w/240/h/158/n/213728.jpg","https://www.43einhalb.com/marken/asics-sportstyle"
