"Sneaker_name","Sneaker_url","Sneaker_img","Sneaker_title","Sneaker_title_url","Sneaker_brand","Sneaker_brand_url","Sneaker_price","Sneaker_description","Sneaker_brand_img","Sneaker_brand_img_url"
"VEJA V-12 Leather (weiß / grün)","https://www.43einhalb.com/p/veja-v-12-leather-weiss-gruen-439334","https://43einhalb.com/media/245289/w/616/h/370/n/veja-xd022336a-v-12-leather-1.jpg","Force 1 TD (weiß)","https://www.43einhalb.com/p/nike-force-1-td-weiss-251838","Nike","https://www.43einhalb.com/p/nike-force-1-td-weiss-251838","€ 124,95","BITTE BEACHTEN: Uns ist aufgefallen, dass der Veja circa eine halbe Nummer Größer ausfällt. Solltet Ihr also zwischen zwei Größen stehen, entscheidet Euch lieber für die kleinere.
Nachhaltig. Fair. Zeitlos. - »Sneakers that are made differently«!
Seit der Unternehmensgründung 2005 stellt VEJA erfolgreich unter Beweis, dass Stilbewusstsein und Nachhaltigkeit auch in der Sneaker-Branche Hand in Hand gehen können. Dabei ist die Idee hinter einem Paar VEJA Sneaker genau so simpel wie genial: Schlüpfe mit einem Fuß in überzeugendes Design und übernehme mit dem anderen soziale Verantwortung!
Doch erstmal von vorne: Im Jahr 2005 stellten sich die beiden französischen VEJA-Gründer Sébastien Kopp und François-Ghislain Morillion eine folgenreiche Frage: »Ist eine andere Welt möglich?« . Um eine Antwort auf diese entscheidende Frage zu finden, begaben sich die Zwei auf eine lange Reise, auf der sie die Entwicklung und Produktion von Turnschuhen sowie die entstehenden Rohstoffpreise nachvollziehen und verstehen wollten. Während ihrer Reise fanden sie nicht nur eine bejahende Antwort auf ihre Frage, sondern auch den Namen ihres neuen Unternehmens - VEJA ist Portugiesisch und beutetet »Schau hin!«. Und genau dies tut das innovative und umweltbewusste Label auch: Getrieben von der Vision das Konsumverhalten nachhaltig zu verändern, setzt VEJA auf transparente Produktionsketten, faire Arbeitsbedingungen und umweltfreundliche Materialien.
Wie alle VEJA-Modelle wurde auch der »VEJA V-12 Leather« in Brasilien unter fairsten Arbeitsbedingungen und aus nachhaltigen Materialen hergestellt. So kommt das Obermaterial aus pflanzlich gegerbten Leder, während das Innenfutter aus biologisch abgebauter Baumwolle besteht. Auch die Sohle ist aus nachhaltigem Naturkautschuk gefertigt. Selbstverständlich braucht der »V 12 Leather« sich auch in Sachen Optik nicht zu verstecken. Das weiße Upper mit dunklerer Mittelsohle garantiert das VEJA-typische cleane Design und einen zeitlosen Look. Gleichzeitig sorgen die coolen Details in Dunkelgrün für den allzeit beliebten Retro-Charme.","https://43einhalb.com/media/237386/w/240/h/158/n/237386.jpg","https://www.43einhalb.com/marken/veja"
"adidas München (blau / weiß)","https://www.43einhalb.com/p/adidas-muenchen-blau-weiss-428962","https://43einhalb.com/media/249453/w/616/h/370/n/adidas-fv1190-muenchen-1.jpg","Cloudswift (blau / weiß)","https://www.43einhalb.com/p/on-cloudswift-blau-weiss-304600","On","https://www.43einhalb.com/p/on-cloudswift-blau-weiss-304600","€ 109,95","Releasedate: 17.10.2020 | Online: 00:01 Uhr.
Erstmals 1976 auf dem Markt erschienen, feiert der nach der bayerischen Hauptstadt benannte München Sneaker als Teil der neu auferlegten City-Series sein langersehntes Comeback. Die schlichte Casual-Silhouette überzeugt uns durch sein hochwertiges, blaues Suede Upper und den weißen Glattleder Details, die vorwiegend am Drei-Streifen-Branding und dem Heel zu sehen sind. Natürlich darf auch bei diesem Sneaker der Serie auch das goldene Branding, angebracht auf den lateralen Seitenpartien des Schuhs, nicht fehlen. Vollendet wird der Look dieses Turnschuhs durch die beliebte Gum Außensohle, welche die Herzen der Retro-Fans mit Sicherheit höher schlagen lassen wird.","https://43einhalb.com/media/58939/w/240/h/158/n/58939.jpg","https://www.43einhalb.com/marken/adidas"
"Nike Air Tailwind 79 SE ""Denim""(beige)","https://www.43einhalb.com/p/nike-air-tailwind-79-se-denimbeige-383578","https://43einhalb.com/media/239493/w/616/h/370/n/nike-ck4712-200-air-tailwind-79-se-1.jpg","V-10 - B-MESH (beige / weiß)","https://www.43einhalb.com/p/veja-v-10%09-b-mesh-beige-weiss-392484","VEJA","https://www.43einhalb.com/p/veja-v-10%09-b-mesh-beige-weiss-392484","€ 99,95","1978 beim Honolulu Marathon zum ersten Mal vorgestellt, wurde der Air Tailwind dann ein Jahr später veröffentlicht – ein Meilenstein der Running-Geschichte. Als erster Schuh überhaupt wurde in der Sohle des Tailwind eine Air-Unit eingebaut, um für Komfort und Dämpfung zu sorgen. Schnell revolutionierte der Air Tailwind die Runningszene mit der neuartigen Technik. Läufer sprachen damals von einem »völlig neuartigen« Gefühl.
Jetzt bringt Nike den legendären Runner mit typischen OG-Vibes an den Start. Der Nike Air Tailwind 79 SE kombiniert ein beiges gewebtes Denim-Upper welches an der Außenseite zu einem Muster mit kontrastreichen dunkleren Maschen wechselt mit beigen Suede-Overlays und einem Swoosh aus Leder. Das gestickte Logo auf der Schaumstoffzunge und der Ferse sorgt für einen angesagten Vintage-Look. Die weiße Mittelsohle sowie die schwarze Waffelsohle runden den schlanken Retro-Look perfekt ab.
Eins steht fest: Wenn’s um Retro Running geht, kommt Ihr am Air Tailwind nicht vorbei!","https://43einhalb.com/media/58940/w/240/h/158/n/58940.jpg","https://www.43einhalb.com/marken/nike"
"Autry Medalist (weiß / blau)","https://www.43einhalb.com/p/autry-medalist-weiss-blau-444776","https://43einhalb.com/media/244840/w/616/h/370/n/autry-aulmll12-01-low-man-1.jpg","Force 1 TD (weiß)","https://www.43einhalb.com/p/nike-force-1-td-weiss-251838","Nike","https://www.43einhalb.com/p/nike-force-1-td-weiss-251838","€ 139,95","BITTE BEACHTEN: Uns ist aufgefallen, dass der Medalist von Autry eine halbe bis ganze Nummer Größer ausfällt. Solltet Ihr also zwischen zwei Größen stehen, entscheidet Euch lieber für die kleinere.
Gegründet 1982 in Dallas (Texas), war Autry in den 80er Jahren eine der angesagtesten Sport-Brands auf dem US-Markt. Damals war das Label auf Tennis, Running und Aerobic Schuhe ausgerichtet und erlangte dank diverser Innovationen im Bereich Design und Technologie sowie einiger Auszeichnungen große Bekanntheit.
Spätestens seit 2019 sorgt Autry mit der originalgetreuen Neuauflage des prämierten »Medalist« Sneaker erneut für Furore – und dieses Mal nicht nur in Nordamerika. An dieser Stelle feiern wir es sehr, dass wir ab sofort »den Schuh mit der amerikanischen Flagge« auch bei uns im Shop begrüßen dürfen!
Hier zeigt sich Autry‘s Signature Schuh »Medalist« im klassichen Tennis-Look. Die farblichen Akzente, das typische Autry-Branding mit US-Flagge und die abgedunkelte Vintage-Sohle sorgen für eine große Portion an Retro-Charme und bleiben der unvergleichlichen Autry-Heritage treu.","https://43einhalb.com/media/250603/w/240/h/158/n/250603.jpg","https://www.43einhalb.com/marken/autry"
"On The Roger Centre Court (weiß)","https://www.43einhalb.com/p/on-the-roger-centre-court%09-weiss-445116","https://43einhalb.com/media/245832/w/616/h/370/n/on-4899438-the-roger-centre-court-1.jpg","Force 1 TD (weiß)","https://www.43einhalb.com/p/nike-force-1-td-weiss-251838","Nike","https://www.43einhalb.com/p/nike-force-1-td-weiss-251838","€ 199,95","Releasedate: 05.11.2020 | Online: 00:01 Uhr.
Nachdem On den »The Roger Centre Court« bereits als ultra-limitierte »0-Serie« releast hat, habt Ihr jetzt bei uns die Chance, Roger Federers Signature-Modell zu erwerben.
Mit dem »The Roger« beweist Die Schweizer Brand On, dass sie nicht nur Performance Schuhe, sondern auch klassische Tennisschuhe entwickeln können! Die Court-Silhouette wurde in Zusammenarbeit mit Tennislegende Roger Federer designt und verfügt über die CloudTec-Technologie, was sich äußerst positiv auf den Tragekomfort auswirkt. Obendrein wurde ein verstecktes Speedboard im Sohlenbereich verbaut, das die Energierückgabe während der Laufbewegung fördert.
Das Upper hingegen ist eher schlicht gehalten und besteht aus einem perforiertem veganem Leder. Abgerundet wird der cleane Look durch diverse goldene Details, wie dem »The Roger« Schriftzug auf der äußeren Seite des Heels und dem eingestanzten On-Branding auf der Zunge.","https://43einhalb.com/media/196879/w/240/h/158/n/196879.jpg","https://www.43einhalb.com/marken/on"
"On WMNS Cloud X (silber / orange)","https://www.43einhalb.com/p/on-wmns-cloud-x-silber-orange-435090","https://43einhalb.com/media/240985/w/616/h/370/n/on-woman-4099699-wmns-cloud-x-1-kopie.jpg","WROAVTK (schwarz / weiß)","https://www.43einhalb.com/p/new-balance-wroavtk-schwarz-weiss-359845","New Balance","https://www.43einhalb.com/p/new-balance-wroavtk-schwarz-weiss-359845","€ 149,95","Releasedate: 30.07.2020 | Online: 00:01 Uhr.
Die kleinen Details sind es, die den neuen Cloud X so besonders machen. Die Einlegesohle mit zwei Dichtegraden, die nahtlose Zunge und die neuesten Innenmaterialien setzen in puncto Komfort ganz neue Massstäbe.
Unsichtbar von außen, aber garantiert spürbar: Der Oberschuh des Cloud X besteht aus hochqualitativem, speziell entwickeltem Feingewebe, das äusserst stabil ist. Der Schuh ist leicht und an den kritischen Stellen atmungsaktiv. So wird Dein Fuß gestützt, ohne die Bewegungsfreiheit einzuschränken.
Die Ferse ist minimalistisch gehalten und glänzt zugleich mit präzise geformten Dämpfungskissen - für Stabilität ganz ohne Überlastung. Einfacher gesagt: Deine Ferse wird im Cloud X optimal gestützt und hat es gleichzeitig bequem. Die Sohle des Cloud X besteht aus dem neuesten Zero-Gravity-Schaum und bietet dank der CloudTec®-Technologie perfekte Beweglichkeit in alle Richtungen.
Wo auch immer Dein Lauf Dich hinführt, dieser Schuh ist dein perfekter Trainingspartner und bringt Dich ans Ziel!","https://43einhalb.com/media/196879/w/240/h/158/n/196879.jpg","https://www.43einhalb.com/marken/on"
"New Balance CM996SMB (schwarz / weiß)","https://www.43einhalb.com/p/new-balance-cm996smb-schwarz-weiss-348093","https://43einhalb.com/media/219431/w/616/h/370/n/nb-774591-60-8-cm996smb-1.jpg","Cloud ""All Black""","https://www.43einhalb.com/p/on-cloud-all-black-106398","On","https://www.43einhalb.com/p/on-cloud-all-black-106398","€ 109,95","Der 996 gehört seit seiner Erstveröffentlichung 1987 zu den Ikonen im New Balance Sortiment. Er war der allererste Running-Schuh, der die 100$-Preis-Marke knackte. Und das nicht ohne Grund. Seine Revlite-Sohleneinheit, seine Gummi-Außensohle und der Suede-Upper begeisterten Läufern und Athleten rund um den Globus.
Jetzt ist er in der Original-Silhouette wieder da und wir sind hin und weg. Schwarzes Suede kombiniert mit grauem Mesh und einheitlichem Stitching, die Lasche aus Leder mit gewobenem Label, reflektierendes 3M »N« auf der Seite und ein Shape, der noch genauso herrlich ist wie damals. Das ist der Stoff aus dem Retro-Träume gemacht werden!
Weitere 996er Modelle findest du in unserer New Balance 996er Übersicht.","https://43einhalb.com/media/212737/w/240/h/158/n/212737.jpg","https://www.43einhalb.com/marken/new-balance"
"Vans Classic Slip-On LX (checkerboard)","https://www.43einhalb.com/p/vans-classic-slip-on-lx-checkerboard-394687","https://43einhalb.com/media/220767/w/616/h/370/n/vans-vn0a45jkt0a1-classic-slip-on-lx-1.jpg","V-10 - B-MESH (beige / weiß)","https://www.43einhalb.com/p/veja-v-10%09-b-mesh-beige-weiss-392484","VEJA","https://www.43einhalb.com/p/veja-v-10%09-b-mesh-beige-weiss-392484","€ 74,95","Die Classic Slip-Ons muss man wohl niemandem mehr vorstellen. Sie sind ein unverzichtbarer Bestandteil der Skatekultur und des Styles von heute. Am Skatest geben sie ein genauso rebellisches Statement ab wie auf der großen Leinwand, und wie überhaupt in allen möglichen Lebenssituationen. Ihre Popularität rund um den Globus verdanken sie ihrer einzigartigen Qualität.
Hier kommt der Vans Classic Slip-On LX Canvas mit seinem klassischen Checkerboard-Print in Schwarz-Weiß daher.","https://43einhalb.com/media/103047/w/240/h/158/n/103047.jpg","https://www.43einhalb.com/marken/vans"
"Birkenstock Sydney MF Python (braun)","https://www.43einhalb.com/p/birkenstock-sydney-mf-python-braun-402917","https://43einhalb.com/media/236070/w/616/h/370/n/birkenstock-woman-1016895-sydney-mf-python-brown-1.jpg","Roraima Suede (braun / schwarz)","https://www.43einhalb.com/p/veja-roraima-suede-braun-schwarz-440168","VEJA","https://www.43einhalb.com/p/veja-roraima-suede-braun-schwarz-440168","€ 69,95","Die Birkenstock Sandalen begeistern uns nun schon seit mehr als 240 Jahren und immer wieder beglückt uns das deutsche Traditionsunternehmen mit neuen Kreationen ihrer Klassiker. Der Erfolg von Birkenstock wurzelt in der Hingabe der Familie an die Kunst des orthopädisch inspirierten Schuhmacherhandwerks. Über die Jahrzehnte hinweg ist ein Erfahrungsschatz gereift, der seinesgleichen sucht und der von Generation zu Generation weitergegeben, kultiviert und weiter ausgebaut wird. Das Fußbett ist das Herzstück eines jeden Modells, passt sich individuell an und garantiert den höchsten Tragekomfort, also gib der Sandale ein bisschen Zeit um sich deinem Fuß perfekt anzupassen. Heute begegnen sie uns überall und sind aus Lifestyle und Fashion nicht mehr wegzudenken, wobei man bei der Dauerpräsenz, die die Schlappen aufweisen, schon nicht mehr nur von einem Trend sprechen kann.
Der Birkenstock Sydney vereint Funktion und Design in höchster Perfektion. Mit seinen zwei schlichten Riemen begeistert er mode- und komfortbewusste Frauen. Hier zeigt sich der Birkenstock-Klassiker von seiner wilden Seite und kommt mit einem angesagten Python-Look daher.","https://43einhalb.com/media/246935/w/240/h/158/n/246935.jpg","https://www.43einhalb.com/marken/birkenstock"
"Birkenstock Sydney MF Python (grau / schwarz)","https://www.43einhalb.com/p/birkenstock-sydney-mf-python-grau-schwarz-402901","https://43einhalb.com/media/236066/w/616/h/370/n/birkenstock-woman-1016893-sydney-mf-python-black-1.jpg","Cloud Hi (grau)","https://www.43einhalb.com/p/on-cloud-hi-grau-362677","On","https://www.43einhalb.com/p/on-cloud-hi-grau-362677","€ 69,95","Die Birkenstock Sandalen begeistern uns nun schon seit mehr als 240 Jahren und immer wieder beglückt uns das deutsche Traditionsunternehmen mit neuen Kreationen ihrer Klassiker. Der Erfolg von Birkenstock wurzelt in der Hingabe der Familie an die Kunst des orthopädisch inspirierten Schuhmacherhandwerks. Über die Jahrzehnte hinweg ist ein Erfahrungsschatz gereift, der seinesgleichen sucht und der von Generation zu Generation weitergegeben, kultiviert und weiter ausgebaut wird. Das Fußbett ist das Herzstück eines jeden Modells, passt sich individuell an und garantiert den höchsten Tragekomfort, also gib der Sandale ein bisschen Zeit um sich deinem Fuß perfekt anzupassen. Heute begegnen sie uns überall und sind aus Lifestyle und Fashion nicht mehr wegzudenken, wobei man bei der Dauerpräsenz, die die Schlappen aufweisen, schon nicht mehr nur von einem Trend sprechen kann.
Der Birkenstock Sydney vereint Funktion und Design in höchster Perfektion. Mit seinen zwei schlichten Riemen begeistert er mode- und komfortbewusste Frauen. Hier zeigt sich der Birkenstock-Klassiker von seiner wilden Seite und kommt mit einem angesagten Python-Look daher.","https://43einhalb.com/media/246935/w/240/h/158/n/246935.jpg","https://www.43einhalb.com/marken/birkenstock"
"New Balance WL574AND (beige)","https://www.43einhalb.com/p/new-balance-wl574and-beige-408977","https://43einhalb.com/media/238633/w/616/h/370/n/nb-819671-50-11-wl574and-1-kopie.jpg","V-10 - B-MESH (beige / weiß)","https://www.43einhalb.com/p/veja-v-10%09-b-mesh-beige-weiss-392484","VEJA","https://www.43einhalb.com/p/veja-v-10%09-b-mesh-beige-weiss-392484","€ 99,95","Wenn man von New Balance spricht, kommt zwangsläufig der 574er zur Sprache. Es ist das seit 1988 immer leuchtende Aushängeschild der Laufschuhmarke, welches Liebhaber als auch New Balance Neulinge gleichermaßen begeistert!
Ausgestattet mit dem ENCAP-System, welches zusätzlich Stabilität und Dämpfung bringt, war der New Balance 574 viele Jahre einer der beliebtesten Laufschuhe. Heute ist er der solideste Lifestyle-Sneaker im New Balance Sortiment, nicht zuletzt weil er den Spagat zwischen Sportlichkeit und Casual wie kaum ein anderer Sneaker beherrscht.
Hier kommt der New Balance WL574AND mit einem beigen Suede-Upper, das dank der coolen Leo-Details auf jeden Fall heraussticht!","https://43einhalb.com/media/212737/w/240/h/158/n/212737.jpg","https://www.43einhalb.com/marken/new-balance"
"VEJA Urca CWL (weiß / gelb / grau)","https://www.43einhalb.com/p/veja-urca-cwl-weiss-gelb-grau-440288","https://43einhalb.com/media/244055/w/616/h/370/n/veja-wmns-uc072440a-urca-cwl-1.jpg","Force 1 TD (weiß)","https://www.43einhalb.com/p/nike-force-1-td-weiss-251838","Nike","https://www.43einhalb.com/p/nike-force-1-td-weiss-251838","€ 129,95","Nachhaltig. Fair. Zeitlos. - »Sneakers that are made differently«!
Seit der Unternehmensgründung 2005 stellt VEJA erfolgreich unter Beweis, dass Stilbewusstsein und Nachhaltigkeit auch in der Sneaker-Branche Hand in Hand gehen können. Dabei ist die Idee hinter einem Paar VEJA Sneaker genau so simpel wie genial: Schlüpfe mit einem Fuß in überzeugendes Design und übernehme mit dem anderen soziale Verantwortung!
Doch erstmal von vorne: Im Jahr 2005 stellten sich die beiden französischen VEJA-Gründer Sébastien Kopp und François-Ghislain Morillion eine folgenreiche Frage: »Ist eine andere Welt möglich?« . Um eine Antwort auf diese entscheidende Frage zu finden, begaben sich die Zwei auf eine lange Reise, auf der sie die Entwicklung und Produktion von Turnschuhen sowie die entstehenden Rohstoffpreise nachvollziehen und verstehen wollten. Während ihrer Reise fanden sie nicht nur eine bejahende Antwort auf ihre Frage, sondern auch den Namen ihres neuen Unternehmens - VEJA ist Portugiesisch und beutetet »Schau hin!«. Und genau dies tut das innovative und umweltbewusste Label auch: Getrieben von der Vision das Konsumverhalten nachhaltig zu verändern, setzt VEJA auf transparente Produktionsketten, faire Arbeitsbedingungen und umweltfreundliche Materialien.
Mit der brandneuen Urca-Silhouette bringt Veja einen neuen Sneaker auf den Markt, der in Sachen Nachhaltigkeit völlig neue Maßstäbe setzt. Der Veja Urca besteht nämlich aus Lebensmittelabfällen und ist somit biologisch abbaubar. Als überarbeitete und komplett vegane Version des beliebten V12-Trainers überzeugt auch der Ucar im Veja-typischen Design. Neben dem zeitlosen und modernen Look besticht der Veja Urca jedoch in erster Linie in Puncto Nachhaltigkeit. Als bisher umweltbewusstester Sneaker im Veja-Sortiment wird der Urca zu 50% aus Abfällen der Lebensmittelindustrie hergestellt und auch sonst besteht das neue Modell ausschließlich aus erneuerbaren land-, maritimen und forstwirtschaftlichen Materialien.","https://43einhalb.com/media/237386/w/240/h/158/n/237386.jpg","https://www.43einhalb.com/marken/veja"
"Nike Air Jordan 11 Low IE ""Black Cement""","https://www.43einhalb.com/p/nike-air-jordan-11-low-ie-black-cement-412350","https://43einhalb.com/media/241640/w/616/h/370/n/nike-919712-006-air-jordan-11-retro-low-ie-1.jpg","Cloud ""All Black""","https://www.43einhalb.com/p/on-cloud-all-black-106398","On","https://www.43einhalb.com/p/on-cloud-all-black-106398","€ 179,95","Releasedate: 16.07.2020 | Online: 09:00 Uhr.
Wir haben was Neues für alle 11er Fans der Jordan-Reihe!
Seitdem Michael Jordan lief erstmalig 1996 mit einem Air Jordan 11 ein NBA- Playoff Spiel bestritt, ist er 11er aus der Jordan Reihe nicht mehr wegzudenken. Jetzt geht der Nike Air Jordan 11 Low IE im starken »Black Cement« Colorway an den Start und liefert so eine frische Version des beliebten Jordan Designs. Er besteht aus leichtem, atmungsaktivem Material. Die durchgehende Air-Dämpfung sorgt in Kombination mit hochwertigen Details für den ultimativen Mix aus Style und Tragekomfort.","https://43einhalb.com/media/58940/w/240/h/158/n/58940.jpg","https://www.43einhalb.com/marken/nike"
"New Balance ML574SSO (rot)","https://www.43einhalb.com/p/new-balance-ml574sso-rot-406879","https://43einhalb.com/media/243432/w/616/h/370/n/nb-819471-60-4-ml574sso-1-kopie.jpg","M670BGW - Made in England (rot / grau)","https://www.43einhalb.com/p/new-balance-m670bgw-made-in-england-rot-grau-407257","New Balance","https://www.43einhalb.com/p/new-balance-m670bgw-made-in-england-rot-grau-407257","€ 89,95","Wenn man von New Balance spricht, kommt zwangsläufig der 574er zur Sprache. Es ist das seit 1988 immer leuchtende Aushängeschild der Laufschuhmarke, welches Liebhaber als auch New Balance Neulinge gleichermaßen begeistert!
Ausgestattet mit dem ENCAP-System, welches zusätzlich Stabilität und Dämpfung bringt, war der New Balance 574 viele Jahre einer der beliebtesten Laufschuhe. Heute ist er der solideste Lifestyle-Sneaker im New Balance Sortiment, nicht zuletzt weil er den Spagat zwischen Sportlichkeit und Casual wie kaum ein anderer Sneaker beherrscht.
Hier kommt der New Balance ML574SSO mit einem schönen Upper in knalligem Rot und weißen Details.","https://43einhalb.com/media/212737/w/240/h/158/n/212737.jpg","https://www.43einhalb.com/marken/new-balance"
"VEJA Rio Branco Hexamesh (beige / rot)","https://www.43einhalb.com/p/veja-rio-branco-hexamesh-beige-rot-435668","https://43einhalb.com/media/242837/w/616/h/370/n/veja-wmns-rb012222-rio-branco-hexamesh-1-kopie.jpg","V-10 - B-MESH (beige / weiß)","https://www.43einhalb.com/p/veja-v-10%09-b-mesh-beige-weiss-392484","VEJA","https://www.43einhalb.com/p/veja-v-10%09-b-mesh-beige-weiss-392484","€ 114,95","Nachhaltig. Fair. Zeitlos. - »Sneakers that are made differently«!
Seit der Unternehmensgründung 2005 stellt VEJA erfolgreich unter Beweis, dass Stilbewusstsein und Nachhaltigkeit auch in der Sneaker-Branche Hand in Hand gehen können. Dabei ist die Idee hinter einem Paar VEJA Sneaker genau so simpel wie genial: Schlüpfe mit einem Fuß in überzeugendes Design und übernehme mit dem anderen soziale Verantwortung!
Doch erstmal von vorne: Im Jahr 2005 stellten sich die beiden französischen VEJA-Gründer Sébastien Kopp und François-Ghislain Morillion eine folgenreiche Frage: »Ist eine andere Welt möglich?« . Um eine Antwort auf diese entscheidende Frage zu finden, begaben sich die Zwei auf eine lange Reise, auf der sie die Entwicklung und Produktion von Turnschuhen sowie die entstehenden Rohstoffpreise nachvollziehen und verstehen wollten. Während ihrer Reise fanden sie nicht nur eine bejahende Antwort auf ihre Frage, sondern auch den Namen ihres neuen Unternehmens - VEJA ist Portugiesisch und beutetet »Schau hin!«. Und genau dies tut das innovative und umweltbewusste Label auch: Getrieben von der Vision das Konsumverhalten nachhaltig zu verändern, setzt VEJA auf transparente Produktionsketten, faire Arbeitsbedingungen und umweltfreundliche Materialien.
Wie alle VEJA-Modelle wurde auch der Rio-Branco Hexamesh in Brasilien unter fairsten Arbeitsbedingungen und aus nachhaltigen Materialen hergestellt. So kommt das Obermaterial aus Hexamesh daher, während das Innenfutter aus biologisch abgebauter Baumwolle besteht. Auch die Sohle ist aus nachhaltigem Naturkautschuk gefertigt. Selbstverständlich braucht der Rio Branco sich auch in Sachen Optik nicht zu verstecken. Die beige-grauen Overlays und weinroten Details auf dem weißen Schuh setzten schöne Akzente und vollenden den lässigen Look.","https://43einhalb.com/media/237386/w/240/h/158/n/237386.jpg","https://www.43einhalb.com/marken/veja"
"Reebok AZ 79 (khaki / orange)","https://www.43einhalb.com/p/reebok-az-79-khaki-orange-373002","https://43einhalb.com/media/240703/w/616/h/370/n/reebok-fx0914-aztec-og-1.jpg","Atacama (olive / schwarz)","https://www.43einhalb.com/p/birkenstock-atacama-olive-schwarz-400724","Birkenstock","https://www.43einhalb.com/p/birkenstock-atacama-olive-schwarz-400724","€ 109,95","Releasedate: 15.07.2020 | Online: 00:01 Uhr.
Es ist kein Geheimnis, dass Reebok ein Händchen dafür hat beinahe vergessene Silhouetten aus den Tiefen der Archiven neues Leben einzuhauchen und in echte Retro-Schätze zu verwandeln. So auch diesmal – Der Aztec ist ganz klar vom klassischen Reebok-Runner inspiriert und versprüht angesagte OG-Vibes.
Der neue Reebok Aztec OG kommt im starken »Army Green« Colorway und mit leichtem Textil-Upper daher. Die orangenen Streifen sorgen für einen coolen Kontrast und eine extra Portion an Retro-Charme.","https://43einhalb.com/media/244388/w/240/h/158/n/244388.jpg","https://www.43einhalb.com/marken/reebok"
